category,sku,product,description,price,breadcrumb,product_url,money_back,rating,total_reviews,tags,type
Sleep apnea,SKU:28125,ResMed Lumis™ 150 VPAP ST ventilator,"Lumis 150 VPAP ST is one of a series of ventilators for people with respiratory conditions who can breathe spontaneously but not efficiently enough. The Lumis 150 VPAP ST is easy to set up and use and features built-in wireless connectivity.*
Responds to your needsTwo therapy modes provide personalised ventilation to support your respiratory condition and automatically adapt to your changing needs while giving you the opportunity to breathe spontaneously.Comfortable, user friendly design Easy to navigate and use, Lumis can gradually and comfortably ramp the pressure up to your prescribed level, and down again at the end of the therapy session.Consistent humidificationWhen used with a HumidAir™ heated humidifier and ClimateLineAir™ heated tube, Lumis delivers humidification automatically. ",,Home > Sleep apnea > CPAP Machines > Bilevels and Bipaps > ResMed Lumis™ 150 VPAP ST ventilator,https://shop.resmed.com.au/resmed-lumis-150-vpap-st-ventilator/,False,0.0,0,Ventilator|Sleep Apnea|HumidAir|ClimateLineAir|Bilevels|Bipaps,Product
Sleep apnea,SKU:38813,ResMed HumidX™ Plus (6 Pack),"6 pack of HumidX Plus capsules for use with AirMini™ compatible AirFit™ nasal and nasal pillows mask systems. Each one provides waterless humidification when used with a ResMed AirMini CPAP machine.
HumidX are small heat and moisture exchangers (HME) designed to provide you with a comfortable experience at home or on holiday.HumidX Plus can be used in dry and high altitude environments where humidity is low. For instance, if you are traveling by plane, this would be the perfect solution.When you exhale, heat and moisture is stored within the HME's tiny paper ridges. When you inhale, this heat and moisture is released to humidify the air you breathe in.Each pack contains 6 capsules for use.ALWAYS READ THE LABEL AND FOLLOW THE INSTRUCTIONS FOR USE. IF SYMPTOMS PERSIST, TALK TO YOUR HEALTHCARE PROFESSIONAL.",59.00,Home > Bestsellers > ResMed HumidX™ Plus (6 Pack),https://shop.resmed.com.au/resmed-humidx-plus-6-pack/,False,4.0,20,HumidX Plus|Sleep Apnea|Heat and Moisture Exchangers|HME|AirMini™|AirFit™,Accessory
Sleep apnea,SKU:63567,ResMed AirFit™ N20 for Her Mask Frame,"Replacement mask frame for AirFit N20 (for Her) Nasal Mask.
This is a replacement mask frame for AirFit N20 (for Her) Nasal Mask. The fabric-lined frame is flexible enough to fit regardless of your face shape or size thanks to its unique design. ",90.00,Home > Sleep apnea > CPAP Accessories > CPAP Mask Headgear > ResMed AirFit™ N20 for Her Mask Frame,https://shop.resmed.com.au/resmed-airfit-n20-for-her-mask-frame/,False,0.0,0,Mask Frame|Sleep Apnea|AirFit N20|CPAP Mask Headgear|ResMed,Accessory
Sleep apnea,SKU:63564,ResMed AirFit™ N20 Mask Magnet Clips (2 Pack),"Replacement magnetic headgear clips in blue for ResMed AirFit N20 CPAP Mask. Pack of 2
",10.00,Home > Sleep apnea > CPAP Accessories > CPAP Mask Parts > ResMed AirFit™ N20 Mask Magnet Clips (2 Pack),https://shop.resmed.com.au/resmed-airfit-n20-mask-magnet-clips-2-pack/,False,4.5,17,Magnet Clips|Sleep Apnea|CPAP|ResMed AirFit N20,Accessory
Sleep apnea,SKU:62938,ResMed AirFit™ P10 Mask Frame,"Replacement Frame for ResMed AirFit P10 Nasal Pillows Mask.
Replacement Frame for ResMed AirFit P10 Nasal Pillows Mask. ",125.00,Home > Sleep apnea > CPAP Accessories > CPAP Mask Headgear > ResMed AirFit™ P10 Mask Frame,https://shop.resmed.com.au/airfit-p10-frame/,False,4.0,1,Headgear|Sleep Apnea|CPAP|Mask|ResMed|AirFit,Accessory
Sleep health,SKU:7078708,Silk Eye Mask,"Look forward to a deep, refreshing night's rest with this deliberately over-sized silk sleeping mask.
Look forward to a deep, refreshing night’s rest with this deliberately oversized, 100% pure silk sleeping mask and eyeshade.It shuts out the maximum amount of distracting light.The padded strap prevents hair entanglement.Choose from blue or black.",55.00,Home > Sleep health > Fall Asleep Faster > Silk Eye Mask,https://shop.resmed.com.au/silk-eye-mask/,True,2.0,1,Silk Eye Mask|Sleep Health|Fall Asleep Faster|Padded Strap|Blue|Black,Accessory
Sleep apnea,SKU:61543,ResMed Swift™ FX for Her Mask Headgear Assembly,"Replacement Headgear Assembly for ResMed Swift FX Bella (For Her series) Nasal Pillows Mask.
Replacement Swift FX For Her headgear loops that wrap easily and gently around your ears, the Bella is simple to wear and easy to adjust. ",110.00,Home > Sleep apnea > CPAP Accessories > CPAP Mask Headgear > ResMed Swift™ FX for Her Mask Headgear Assembly,https://shop.resmed.com.au/resmed-swift-fx-for-her-headgear-assembly/,False,0.0,0,Headgear|Sleep Apnea|CPAPMask|Swift FX|Bella,Accessory
Insomnia,SKU:7078710,Dreampad™,"Lull yourself to sleep faster with music on a pillow that only you can hear. Custom-designed medium firmness pillows that connect to your phone and provide a unique sound experience that only you can hear.
Uses sound vibrations Only you can hear the music. Dreampad’s sound vibrations are detected by your inner ear to help usher in a deep and uninterrupted night’s sleep.7 songs engineered for deep sleep Your Dreampad app* includes 7 songs and soundscapes chosen for their ability to induce sleep. You can also play your own favourite tunes. Play for a few minutes or all night. Use the timer to play the music as long as you wish.Want to know more?",189.00,Home > Sleep health > Pillows > Dreampad™,https://shop.resmed.com.au/dreampad-pillow/,True,2.3,3,Dreampad™|Insomnia|Sound Vibrations|Music Pillow|Deep Sleep,Product
Sleep apnea,SKU:38841,ResMed AirMini™ Hard Case,"Protect your ResMed AirMini device when you travel with this rigid carry case.
Protect your ResMed AirMini device with this rigid grey carry case. It even fits into the Premium carry bag!It's convenient and useful when travelling as it is just the right fit for any suitcase.Only available for the AirMini device.",50.00,Home > Sleep apnea > CPAP Accessories > CPAP Bags > ResMed AirMini™ Hard Case,https://shop.resmed.com.au/resmed-airmini-hard-case/,False,2.0,1,Hard Case|Sleep Apnea|ResMed AirMini|CPAP Bags,Accessory
Sleep apnea,SKU:38815,ResMed AirMini™ Filters (2 Pack),"Block fine dust from entering your AirMini device with these disposable filters. Pack of two.
Keep your AirMini device clean by using these filters to block fine materials and larger particles from entering your machine.Sold as a pack of 2 filters. These standard air filters are only suitable for use with the ResMed AirMini device.These filters are disposable and aren't suitable for washing.",5.90,Home > Bestsellers > ResMed AirMini™ Filters (2 Pack),https://shop.resmed.com.au/resmed-airmini-filters-2-pack/,False,4.6,5,Filters|ResMed AirMini|Sleep Apnea|Disposable|Pack of 2,Accessory
Sleep tests and trackers,,myNight™ - snore detection app,"myNight by ResMed is our free sleep companion app that empowers you to take action on your sleep health. myNight uses contactless, silent sonar technology to track your sleep, monitor your snoring and improve your sleep habits. Track and benchmark your sleep performance with a nightly sleep quality score.
",,Home > Sleep tests and trackers > Track Your Sleep > myNight™ - snore detection app,https://shop.resmed.com.au/mynight-snore-detection-app/,False,0.0,0,Snore Detection App|myNight|Sleep Tests|Sleep Trackers|Sleep Quality Score,App
Sleep health,SKU:113491,The Little Box of Sleep,"Everything you need to create a better sleep ritual.
Welcome to your Little Box of Sleep.Designed to help you create a better sleep ritual.Your little box of sleep includes:The soft contoured eye mask is designed to block out all light without putting pressure on your eyes. Easy to wear with an adjustable, stretchable velcro strap for the perfect fit.  The Sweet Dreams light bulbs can help improve the quality and duration of your sleep. The sleep enhancing LED light supports your natural sleep cycle and allows your body to prepare for sleep. The specialised colour spectrum delivers warm evening lighting that supports natural melatonin production. For best results turn off other artificial lighting and electronics and use the Sweet Dream light bulbs for about an hour before going to bed.Sleepy Time tea is an aromatic infusion of caffeine-free herbs. Specially blended to help you relax and unwind at the end of a busy day. Made from organic ingredients. Contains chamomile, lime blossom, skullcap, hops, lemon balm and passion flower. Best to drink this 30 min before you go to bed.Sweet dreams. ",69.00,Home > Sleep health > Pre-Bedtime Aids > The Little Box of Sleep,https://shop.resmed.com.au/the-little-box-of-sleep/,False,0.0,0,Sleep Ritual|Eye Mask|LED Light|Sleepy Time Tea|Chamomile|Lime Blossom|Skullcap|Hops|Lemon Balm|Passion Flower,Product
Insomnia,SKU:RETIMER,Re-timer Light Therapy Glasses,"Re-timer, a portable light therapy glasses for people on the go. These glasses use unique UV-free, sleep-inducing lights to get your sleeping pattern balanced. Simply put them on for 30 minutes a day while you get your day started or use them later while you relax after work.
University developed and backed by 25 years of research, Re-Timer uses light therapy, to re-program your body's sleep schedule. Re-Timer glasses should be worn for 30 minutes a day. Travellers who need to combat jet lag, shift workers and people who suffer from the winter blues due to reduced exposure to natural light",299.00,Home > Sleep health > Glasses > Re-timer Light Therapy Glasses,https://shop.resmed.com.au/re-timer-light-therapy-glasses/,True,5.0,1,Light Therapy|Insomnia|Re-timer|Glasses|Jet Lag,Product
Sleep apnea,SKU:38816,ResMed AirMini™ Filters (12 Pack),"Keep fine dust and other particles out of your AirMini device with this 12 pack of disposable filters.
Keep your AirMini device clean by using these filters to block fine materials and larger particles from entering your machine.Sold as a pack of 12 filters. These standard air filters are only suitable for use with the ResMed AirMini device.One side of the filter blocks fine particles such as dust and the other blocks larger matter, like hair.These filters are disposable and aren't suitable for washing.",29.90,Home > Sleep apnea > CPAP Accessories > CPAP Filters > ResMed AirMini™ Filters (12 Pack),https://shop.resmed.com.au/resmed-airmini-filters-12-pack/,False,4.8,13,Filters|Sleep Apnea|ResMed AirMini™|Disposable|Dust,Accessory
Sleep health,,Bambi Cooltouch Flip Ingeo Pillow,"The Bambi Cool Touch Ingeo Corn Fibre Flip Pillow boasts a cool side for warm nights and a regular side for normal sleep
",89.00,Home > Sleep health > Pillows > Bambi Cooltouch Flip Ingeo Pillow,https://shop.resmed.com.au/bambi-cooltouch-flip-ingeo-pillow/,False,0.0,0,Pillow|Sleep Health|Bambi|Cooltouch|Ingeo,Product
Sleep apnea,SKU:36996,ResMed ClimateLine™ Max Oxy Heated Tubing,"Ideal tubing for people who need supplemental oxygen.
If you require additional oxygen, this tubing is perfect for you! It easily connects at the back of your device, removing the hassle of another tube getting in the way. Supplemental oxygen is mixed with warmed, humidified air for your comfort.ALWAYS READ THE LABEL AND FOLLOW THE INSTRUCTIONS FOR USE. IF SYMPTOMS PERSIST, TALK TO YOUR HEALTHCARE PROFESSIONAL.CPAP TUBES✓✓     XX✓✓ X✓XXX✓Resmed Airmini OnlyResmed S9 Series Only",99.00,Home > Sleep apnea > CPAP Accessories > Tubing > ResMed ClimateLine™ Max Oxy Heated Tubing,https://shop.resmed.com.au/resmed-climateline-max-oxy-tubing/,False,5.0,1,Tubing|Oxygen|ResMed|Sleep Apnea|ClimateLine,Accessory
Sleep apnea,SKU:37296,ResMed ClimateLineAir™ Heated Tubing for AirSense™ 10,"For AirSense 10 CPAP machines. This heated tubing provides the optimal temperature and humidity for your comfort and virtually eliminates rainout.
The ClimateLineAir is a heated tube that is purpose-built for ResMed AirSense 10 devices.This heated tube is specially designed to provide you with the optimal temperature and humidity for your comfort and virtually eliminates rainout.ALWAYS READ THE LABEL AND FOLLOW THE INSTRUCTIONS FOR USE. IF SYMPTOMS PERSIST, TALK TO YOUR HEALTHCARE PROFESSIONAL.CPAP TUBES✓✓     XX✓✓ X✓XXX✓Resmed Airmini OnlyResmed S9 Series Only",69.00,Home > Sleep apnea > CPAP Accessories > Tubing > ResMed ClimateLineAir™ Heated Tubing for AirSense™ 10,https://shop.resmed.com.au/resmed-climateline-tubing-for-airsense-10/,False,4.6,61,Tubing|Sleep Apnea|ResMed|AirSense 10|ClimateLineAir,Accessory
Sleep apnea,SKU:36995,ResMed ClimateLine™ Heated Tubing for S9™ CPAP Machines,"This tubing delivers warmed air at a consistent humidity level and is a key component of the Climate Control humidification system.
The ClimateLineAir tubing is designed for your comfort.For use with ResMed S9 CPAP machines.The tubing delivers warmed air at consistent humidity level and is a key component of the Climate Control humidification system.ALWAYS READ THE LABEL AND FOLLOW THE INSTRUCTIONS FOR USE. IF SYMPTOMS PERSIST, TALK TO YOUR HEALTHCARE PROFESSIONAL.CPAP TUBES✓✓     XX✓✓ X✓XXX✓Resmed Airmini OnlyResmed S9 Series Only",69.00,Home > Sleep apnea > CPAP Accessories > Tubing > ResMed ClimateLine™ Heated Tubing for S9™ CPAP Machines,https://shop.resmed.com.au/resmed-climateline-tubing-for-s9-cpap-machines/,False,4.3,15,CPAP Tubes|Resmed Airmini|Resmed S9 Series|ClimateLineAir|Humidification System|Sleep Apnea,Accessory
Sleep apnea,SKU:37343,ResMed Connector Cable for AirSense™ 10 to ResMed Power Station II,"Connect your ResMed AirSense 10 CPAP machine to the external Power Station II battery with this DC cable.
",40.00,Home > Sleep apnea > CPAP Accessories > Batteries and Power > ResMed Connector Cable for AirSense™ 10 to ResMed Power Station II,https://shop.resmed.com.au/resmed-connector-cable-for-airsense-10-to-powerstation-ii/,False,5.0,1,Connector Cable|Sleep Apnea|Power Station II|ResMed|AirSense 10,Accessory
Sleep apnea,SKU:24961,ResMed Connector Cable for S9™ to ResMed Power Station II,"Connect your ResMed S9 CPAP machine to the external Power Station II battery with this DC cable.
",45.00,Home > Sleep apnea > CPAP Accessories > Batteries and Power > ResMed Connector Cable for S9™ to ResMed Power Station II,https://shop.resmed.com.au/resmed-connector-cable-from-s9-to-powerstation-ii/,False,5.0,1,Connector Cable|Sleep Apnea|ResMed|Power Station II|CPAP,Accessory
Sleep apnea,SKU:37297,"ResMed AirSense™ 10, AirCurve™ 10 and Lumis™ DC-DC Converter","Run your AirSense 10, AirCurve 10 or Lumis machine from a suitable DC power source like your car, boat or caravan.
Heading off on holidays and need to connect your AirSense 10, AirCurve 10 or Lumis machine?With this DC/DC converter, you can connect your machine to a car, truck, caravan, boat or any other vehicle with a suitable battery. This converter draws approximately 1 amp of power and uses the vehicle's cigarette lighter socket (12V or 24V DC power source).ALWAYS READ THE LABEL AND FOLLOW THE INSTRUCTIONS FOR USE. IF SYMPTOMS PERSIST, TALK TO YOUR HEALTHCARE PROFESSIONAL.",169.00,"Home > Sleep apnea > CPAP Accessories > Batteries and Power > ResMed AirSense™ 10, AirCurve™ 10 and Lumis™ DC-DC Converter",https://shop.resmed.com.au/resmed-converter-for-airsense-10-dc-dc/,False,4.7,23,DC-DC Converter|Sleep Apnea|AirSense 10|AirCurve 10|Lumis,Accessory
Sleep apnea,SKU:36970,ResMed DC 12v and 24v S9 Model Converter,"Operate your ResMed S9 machine from a suitable 12v or 24v DC power source like a boat or campervan.
Wondering how to continue using your ResMed S9 CPAP machine on holiday?This converter will help solve your problem!It easily connects your device on a car, truck, caravan, boat or any suitable 12 V or 24V power source.",185.00,Home > Sleep apnea > CPAP Accessories > Batteries and Power > ResMed DC 12v and 24v S9 Model Converter,https://shop.resmed.com.au/resmed-dc-12v-and-24v-s9-model-converter/,False,5.0,3,Converter|Sleep Apnea|ResMed|CPAP|Batteries|Power,Accessory
Sleep apnea,SKU:36859,ResMed Filter Cover for S9™ Series Machines,"Need a new filter cover for your ResMed S9 CPAP machine? You found it!
This Filter Cover is used to cover the filter compartment of your ResMed S9 CPAP Machine.It's easy to take off and put on, making it quick and simply for you to change the filter to give you filtered air during your therapy.If you lose or break the filter cover on your device, this is the perfect replacement!",8.90,Home > Sleep apnea > CPAP Accessories > CPAP Machine Parts > ResMed Filter Cover for S9™ Series Machines,https://shop.resmed.com.au/resmed-filter-cover-for-s9-series-machines/,False,0.0,0,Filter Cover|Sleep Apnea|CPAP Accessories|ResMed|S9 Series Machines,Accessory
Sleep apnea,SKU:24946,ResMed RPSII Power Supply Unit Adapter,"Connect your ResMed S9 CPAP machine to the Power Station II battery with this adapter.
",40.00,Home > Sleep apnea > CPAP Accessories > Batteries and Power > ResMed RPSII Power Supply Unit Adapter,https://shop.resmed.com.au/resmed-rpsii-power-supply-unit-adapter/,False,0.0,0,Power Supply Unit|Adapter|ResMed|CPAP|Sleep Apnea,Accessory
Sleep apnea,SKU:37342,ResMed PSU Adapter for AirSense™ 10,"Connect your ResMed AirSense device with the Power Station II for recharging.
",32.00,Home > Sleep apnea > CPAP Accessories > Batteries and Power > ResMed PSU Adapter for AirSense™ 10,https://shop.resmed.com.au/resmed-psu-adapter-for-airsense-10/,False,0.0,0,PSU Adapter|AirSense™ 10|Sleep Apnea|Recharging|Batteries and Power,Accessory
Sleep apnea,SKU:36857,ResMed Hypoallergenic Filters (12 Pack),"Suffer from allergies? Filter out dust and pollen with these hypoallergenic filters suitable for use with ResMed S9 and AirSense 10 CPAP machines.
Hypoallergenic filters for those who suffer from hayfever or other airborne allergies.These filters are suitable for use with your ResMed S9 CPAP machine or your AirSense 10 AutoSet.Each pack contains 12 filters.ALWAYS READ THE LABEL AND FOLLOW THE INSTRUCTIONS FOR USE. IF SYMPTOMS PERSIST, TALK TO YOUR HEALTHCARE PROFESSIONAL.",34.90,Home > Sleep apnea > CPAP Accessories > CPAP Filters > ResMed Hypoallergenic Filters (12 Pack),https://shop.resmed.com.au/resmed-hypoallergenic-filters-12-pack/,False,4.3,13,Hypoallergenic Filters|ResMed|CPAP Machines|AirSense 10|S9 CPAP|12 Pack,Accessory
Sleep apnea,SKU:31336,ResScan™ Version 6.1 Software,"ResScan is a computer-based data management software (CD). It is intended to be used by Clinicians in conjunction with ResMed compatible therapy devices, using ResMed's proprietary communications protocol.
ResScan is a computer-based (CD) data management software. It takes a deeper look into your therapy performance using statistics and graphs allowing you to review your therapy breath-by-breath in order to better understand your progress.ResScan 6.1 is compatible with most devices and the data can be collected via the Data Card or USB, depending on the device you are using.Note: Only one can be purchased.ResMed ResScan Version 6.1 Software (sku: 31336) is the latest and followup version to ResMed ResScan Version 6.0.2 Software (sku: 31335)ALWAYS READ THE LABEL AND FOLLOW THE INSTRUCTIONS FOR USE. IF SYMPTOMS PERSIST, TALK TO YOUR HEALTHCARE PROFESSIONAL. ",29.99,Home > Sleep apnea > CPAP Accessories > Data Management > ResScan™ Version 6.1 Software,https://shop.resmed.com.au/resscan-version-6-0-software/,False,3.0,24,ResScan™|Data Management|Software|Sleep Apnea|Version 6.1,Product
Sleep apnea,SKU:24926,ResMed Power Station II Battery,"Have power will travel! This external battery enables your device to function where power mains aren't available.
",,Home > Sleep apnea > CPAP Accessories > Batteries and Power > ResMed Power Station II Battery,https://shop.resmed.com.au/resmed-remote-power-station-ii-battery/,False,0.0,0,Battery|Sleep Apnea|Power Station II|ResMed,Accessory
Sleep apnea,SKU:24952,ResMed RPSII Carry Bag,"An ideal carry bag for your Power Station II (external battery). It's perfect for travel!
An ideal carry bag for your Power Station II (external battery). It's perfect for travel!ALWAYS READ THE LABEL AND FOLLOW THE INSTRUCTIONS FOR USE. IF SYMPTOMS PERSIST, TALK TO YOUR HEALTHCARE PROFESSIONAL.",60.00,Home > Sleep apnea > CPAP Accessories > CPAP Bags > ResMed RPSII Carry Bag,https://shop.resmed.com.au/resmed-rpsii-carry-bag/,False,0.0,0,Carry Bag|Sleep Apnea|Power Station II|External Battery|Travel,Accessory
Track Your Sleep,,AirMini App - For AirMini Machine Users Only,"AirMini App by ResMed is the perfect CPAP companion app. With Bluetooth connectivity, you can monitor your sleep health and adjust your therapy settings even when traveling. Coaching and support, video tutorials, self-help tools, and remote therapy tracking are also all available. Download it today.
",,Home > Sleep tests and trackers > Track Your Sleep > AirMini App - For AirMini Machine Users Only,https://shop.resmed.com.au/airmini-app/,False,0.0,0,AirMini App|Sleep Health|Therapy Settings|Bluetooth Connectivity|Coaching and Support|Video Tutorials|Self-Help Tools|Remote Therapy Tracking,App
Sleep apnea,SKU:33976,ResMed S8 Hypoallergenic Filters (12 Pack),"Filters are a must-have for your ResMed S8 CPAP device if you suffer from allergies. These filters block particles such as dust, pollen and hair.
The disposable Hypoallergenic Filters are a must-have for your devices if you suffer from any allergies.This filter cleans the air as it enters your device.It consists of a combination of materials, with one side to block fine particles and the other to ward off large particles such as hair.",34.90,Home > Sleep apnea > CPAP Accessories > CPAP Filters > ResMed S8 Hypoallergenic Filters (12 Pack),https://shop.resmed.com.au/resmed-s8-hypoallergenic-filters-12-pack/,False,4.0,1,Filters|Hypoallergenic|Sleep Apnea|ResMed S8|CPAP,Accessory
Sleep apnea,SKU:36856,ResMed S9™ and AirSense™ 10 Hypoallergenic Filters (2 Pack),"Hypoallergenic Filters for use with any ResMed S9 or AirSense 10 devices.
The disposable Hypoallergenic Filters are designed to prevent debris and other particles from entering your device.These are available in a 2 pack. They are compatible with any S9 device and AirSense 10 devices.They should be changed regularly, around every 1-2 months.ALWAYS READ THE LABEL AND FOLLOW THE INSTRUCTIONS FOR USE. IF SYMPTOMS PERSIST, TALK TO YOUR HEALTHCARE PROFESSIONAL.",7.49,Home > Sleep apnea > CPAP Accessories > CPAP Filters > ResMed S9™ and AirSense™ 10 Hypoallergenic Filters (2 Pack),https://shop.resmed.com.au/resmed-s9-and-airsense-10-hypoallergenic-filters-2-pack/,False,4.4,25,Hypoallergenic Filters|ResMed S9|AirSense 10|Sleep Apnea|CPAP Filters,Accessory
Sleep apnea,SKU:36920,ResMed S9™ Power Supply Unit 30W,"A lightweight, convenient 30W power solution for your ResMed S9 machine when you're travelling.
The S9 30W power supply is a great choice if you want a lightweight, convenient power solution for your device when you're travelling.It's a small power supply suitable for any ResMed S9 series device that you are using, if you don't need to use an H5i Heated Humidifier.",40.00,Home > Sleep apnea > CPAP Accessories > Batteries and Power > ResMed S9™ Power Supply Unit 30W,https://shop.resmed.com.au/resmed-s9-power-supply-unit-30w/,False,0.0,0,Power Supply|ResMed S9|30W|Sleep Apnea|CPAP Accessories,Accessory
Sleep apnea,SKU:36860,ResMed S9™ Travel Bag,"Your go to bag when travelling with your ResMed S9 CPAP machine.
The S9 Travel Bag is compact and convenient to hold your S9 device and humidifier while you're travelling.The bag has an additional storage compartment for extras, such as cleansing wipes or spare filters.",39.95,Home > Sleep apnea > CPAP Accessories > CPAP Bags > ResMed S9™ Travel Bag,https://shop.resmed.com.au/resmed-s9-travel-bag/,False,5.0,1,Travel Bag|ResMed S9|Sleep Apnea|CPAP Accessories|CPAP Bags,Accessory
Sleep apnea,SKU:36824,ResMed S9™ Power Supply Unit 90W,"The S9 90W power supply is an ideal for people using ResMed S9 machines with a Humidifier.
The S9 90W power supply is an ideal for people using ResMed S9 machines with a Humidifier.Q: Is this S9 Power Supply unit simply an uninterruptible power supply only to be used in conjunction with a regular AC (50 Hz 240 V) power supply? A: No, it is the basic power pack (mains to machine) required to run an S9 with a humidifier attached. An S9 not using a humidifier can use the 30w Power Supply unitQ: Is this part a 240 volt to 24 volt genuine ResMed power supply? A: Yes this is the genuine 90w ResMed power supply required to power both the machine and humidifierQ: Will this S9 Power Supply unit work in India? A: This is a power supply unit with an Australian plug configuration. In another country you would need to convert the plug configuration, however, this change would not affect the operation of the unit as it automatically works between 110v and 240v.",65.00,Home > Sleep apnea > CPAP Accessories > Batteries and Power > ResMed S9™ Power Supply Unit 90W,https://shop.resmed.com.au/resmed-s9-power-supply-unit-90w/,False,4.8,4,Power Supply|Uninterruptible Power Supply|ResMed S9|Humidifier|240V|110V,Accessory
Sleep apnea,SKU:14915,ResMed Side Port Oxygen Connector,"ResMed Side Port Oxygen Connector.
",16.00,Home > Sleep apnea > CPAP Accessories > CPAP Mask Parts > ResMed Side Port Oxygen Connector,https://shop.resmed.com.au/resmed-side-port-oxygen-connector/,False,1.0,1,Oxygen Connector|Sleep Apnea|CPAP Accessories|ResMed,Accessory
