category,sku,product,description,price,breadcrumb,product_url,money_back,rating,total_reviews,tags,type
Sleep apnea,,ResMed AirFit™ P10 Pillows Mask,"The AirFit P10 nasal pillows mask comes complete with frame, a selection of nasal pillows, and an adjustable QuickFit™ elastic headgear. Select blue ""Standard"" (incl. S, M, and L nasal pillows) or pink ""for Her"" (incl. XS, S, and M nasal pillows).
Key FeaturesSize OptionsAirFit P10 GuidesALWAYS READ THE LABEL AND FOLLOW THE INSTRUCTIONS FOR USE. IF SYMPTOMS PERSIST, TALK TO YOUR HEALTHCARE PROFESSIONAL.",209.00,Home > Sleep apnea > CPAP Masks > Nasal Pillow Masks > ResMed AirFit™ P10 Pillows Mask,https://shop.resmed.com.au/resmed-airfit-p10-pillows-mask/,True,4.4,42,Pillows Mask|Sleep Apnea|ResMed AirFit™ P10|QuickFit™|Standard|for Her,Product
Sleep apnea,SKU:61919,ResMed CPAP Wipes for Travel (14 Pack),"Handy travel pack of 14 wipes to keep your mask clean and dust free.
Our CPAP mask wipes are a ready-to-use, fast and easy cleaning solution for your mask.Comes in a handy box of 14 single sachet wipes, which are perfect for travel. These 100% cotton wipes contain an unscented cleaning agent and aloe vera and are free from alcohol and latex.You can wipe your mask clean from any dirt and oils and enjoy all the benefits of a fresh, clean mask. You should remove facial oils from your mask after each use to optimise the seal of the mask. Used regularly, these wipes will gently remove dirt, oils and other organic residues from the mask without hardening or deteriorating any parts, helping you to enjoy a fresh, clean therapy experience.Also available in an economical  - ideal for everyday use.ALWAYS READ THE LABEL AND FOLLOW THE INSTRUCTIONS FOR USE. IF SYMPTOMS PERSIST, TALK TO YOUR HEALTHCARE PROFESSIONAL.",8.80,Home > Sleep apnea > CPAP Accessories > CPAP Cleaning > ResMed CPAP Wipes for Travel (14 Pack),https://shop.resmed.com.au/resmed-cpap-wipes-for-travel-14-pack/,False,4.8,4,Wipes|Travel|Cleaning|CPAP|ResMed,Accessory
Sleep apnea,,ResMed AirFit™ N20 Classic Mask Headgear,"Replacement headgear for ResMed AirFit N20 Classic nasal mask.
",75.00,Home > Sleep apnea > CPAP Accessories > CPAP Mask Headgear > ResMed AirFit™ N20 Classic Mask Headgear,https://shop.resmed.com.au/resmed-airfit-n20-classic-headgear/,False,0.0,0,Headgear|Sleep Apnea|CPAP Mask|ResMed AirFit™ N20 Classic|N20 Classic,Accessory
Sleep apnea,SKU:61527,ResMed Swift™ FX Mask Short Tubing Assembly (10 Pack),"Used to attach the tubing from your CPAP machine to your Swift FX mask. (Pack of ten)
The short tube assembly is part of the Swift FX nasal mask.It is used to attach the tubing from your device to your mask. You can remove and replace the tube assembly from your mask by removing the ring from the cushion.This comes in a pack of 10.",620.00,Home > Sleep apnea > CPAP Accessories > Tubing > ResMed Swift™ FX Mask Short Tubing Assembly (10 Pack),https://shop.resmed.com.au/resmed-swift-fx-short-tubing-assembly-10-pack/,False,0.0,0,Tubing|Sleep Apnea|CPAP Accessories|ResMed Swift™ FX Mask|Short Tubing Assembly,Accessory
Sleep apnea,,ResMed AirFit™ N30i Mask Cushion,"Replacement cushion for the AirFit N30i nasal cradle mask.
Don't buy a whole new mask, simply replace the nasal cushion of your  to save money and reduce waste. ",85.00,Home > Sleep apnea > CPAP Accessories > CPAP Mask Cushions > ResMed AirFit™ N30i Mask Cushion,https://shop.resmed.com.au/resmed-airfit-n30i-nasal-cradle-cushion/,False,4.0,25,Cushion|Sleep Apnea|AirFit N30i|CPAP Mask|ResMed,Accessory
Sleep apnea,,ResMed AirFit™ P30i Mask Cushion,"Replacement pillows cushion for the AirFit P30i pillows CPAP mask.
Time to replace the cushion on your AirFit P30i mask? Don't buy a whole new mask, simply replace worn parts to save money and reduce waste. AirFit P30i pillows cushion is interchangeable with AirFit N30i nasal cradle cushion.",89.00,Home > Sleep apnea > CPAP Accessories > CPAP Mask Cushions > ResMed AirFit™ P30i Mask Cushion,https://shop.resmed.com.au/resmed-airfit-p30i-pillows-cushion/,False,3.2,9,Cushion|Sleep Apnea|CPAP|AirFit P30i|Mask,Accessory
Sleep apnea,,ResMed AirTouch™ F20 Mask Cushion (Single),"Replacement cushion for ResMed's AirTouch F20 full face mask. This soft, breathable memory foam cushion is also compatible with the AirFit F20 full face mask frame. Single cushion only.
The UltraSoftmemory foam cushion for the AirTouchF20 full-face mask brings a new level of comfort to sleep apnea therapy. This replaceable cushion adapts to your facial profile to deliver outstanding fit and seal, but remains breathable. The unique properties of foam minimise contact pressure on your skin, reducing the likelihood of red facial marks on your skin.Designed to enhance your CPAP experience with easy maintenance, ResMed recommends to replace the AirTouch UltraSoft memory foam cushion every 4 weeks to ensure optimum comfort.Try out the memory foam cushion and experience the difference.",29.00,Home > Sleep apnea > CPAP Accessories > CPAP Mask Cushions > ResMed AirTouch™ F20 Mask Cushion (Single),https://shop.resmed.com.au/resmed-airtouch-f20-cushion-single/,False,4.1,24,Cushion|Sleep Apnea|CPAP|AirTouch|UltraSoft|Memory Foam,Accessory
Sleep apnea,SKU:63494,ResMed AirFit F20/F30 QuietAir Elbow,"
",50.00,Home > Sleep apnea > CPAP Accessories > CPAP Mask Parts > ResMed AirFit F20/F30 QuietAir Elbow,https://shop.resmed.com.au/resmed-airfit-f20-f30-quietair-elbow/,False,4.5,10,Elbow|Sleep Apnea|CPAP|QuietAir|ResMed,Accessory
Sleep apnea,SKU:10ANXK,REMZzz Nasal Padded Liners Extra Small (30 pack),"
",50.00,Home > Sleep apnea > CPAP Accessories > CPAP Mask Cushions > REMZzz Nasal Padded Liners Extra Small (30 pack),https://shop.resmed.com.au/remzzz-nasal-padded-liners-extra-small-30-pack/,False,0.0,0,Liners|Extra Small|Sleep Apnea|REMZzz|CPAP Mask Cushions,Accessory
Sleep apnea,SKU:7ANPK,REMZzz Nasal Pillow Padded Liners (30 pack),"
",50.00,Home > Sleep apnea > CPAP Accessories > CPAP Mask Cushions > REMZzz Nasal Pillow Padded Liners (30 pack),https://shop.resmed.com.au/remzzz-nasal-pillow-padded-liners-30-pack/,False,0.0,0,Nasal Pillow|Padded Liners|Sleep Apnea|REMZzz|CPAP Mask Cushions,Accessory
Sleep apnea,SKU:10ANXS,REMZzz Nasal Padded Liners Extra Small (SAMPLE 6 pack),"
",15.00,Home > Sleep apnea > CPAP Accessories > CPAP Mask Cushions > REMZzz Nasal Padded Liners Extra Small (SAMPLE 6 pack),https://shop.resmed.com.au/remzzz-nasal-padded-liners-extra-small-sample-6-pack/,False,0.0,0,Liners|Extra Small|Sleep Apnea|REMZzz|Padded|Sample,Accessory
Sleep apnea,SKU:64206,ResMed AirFit™ N30 Nasal Cradle Mask,"Resmed Airfit N30 is a CPAP mask that discreetly fits into your lifestyle to help adjust to therapy. Designed to be low profile and silent this mask is for side sleepers who are adjusting to their CPAP therapy. One of Resmed's lightest masks that provides support and comfort using a soft under the nose cradle cushion and a slip-on headgear.
With its simple design and slip-on headgear, this mask aims to fit into your lifestyle with ease. And with its narrow profile, the cushion sits evenly under your nose, so it's a great option if you sleep on your side.Key FeaturesAirFit N30 guidesALWAYS READ THE LABEL AND FOLLOW THE INSTRUCTIONS FOR USE. IF SYMPTOMS PERSIST, TALK TO YOUR HEALTHCARE PROFESSIONAL.",249.00,Home > Sleep apnea > CPAP Masks > Nasal Cradle Masks > ResMed AirFit™ N30 Nasal Cradle Mask,https://shop.resmed.com.au/resmed-airfit-n30-nasal-cradle-mask/,True,4.2,9,CPAP Mask|Nasal Cradle Mask|Sleep Apnea|ResMed AirFit™ N30|AirFit N30,Product
Sleep apnea,,ResMed AirFit™ N30 Nasal Cradle Cushion,"Replacement cushion for the AirFit N30 nasal cradle mask.
Don't buy a whole new mask, simply replace the nasal cushion to save money and reduce waste.",85.00,Home > Sleep apnea > CPAP Accessories > CPAP Mask Cushions > ResMed AirFit™ N30 Nasal Cradle Cushion,https://shop.resmed.com.au/resmed-airfit-n30-mask-cushion/,False,3.2,5,Cushion|Sleep Apnea|Nasal Cradle|AirFit N30|ResMed,Accessory
Sleep apnea,,ResMed AirFit™ F30i Full Face Mask,"AirFit F30i is a minimal-contact full face mask, designed for all sleeping positions. Designed with two magnetic clips to slip your mask on and off with ease. The under-the-nose cushion gives you the freedom to relax and watch a show before bed, by giving you a wider frame of vision. While the mouth cover delivers consistent humidity and comfort for mouth breathers.
ResMed AirFit F30i full face mask features a comfortable UltraCompact cushion and top-of-head tube connection, so you have the freedom to sleep in many positions. Thanks to the under-the-nose cushion, red marks and discomfort on your nasal bridge are a thing of the past.Key FeaturesSize OptionsAirFit F30i GuidesALWAYS READ THE LABEL AND FOLLOW THE INSTRUCTIONS FOR USE. IF SYMPTOMS PERSIST, TALK TO YOUR HEALTHCARE PROFESSIONAL. ",249.00,Home > Sleep apnea > CPAP Masks > Full Face Masks > ResMed AirFit™ F30i Full Face Mask,https://shop.resmed.com.au/resmed-airfit-f30i-full-face-mask/,True,3.9,31,Full Face Mask|Sleep Apnea|ResMed AirFit™ F30i|UltraCompact Cushion|Top-of-Head Tube Connection,Product
Sleep apnea,SKU:63373,ResMed AirFit™ F30i Soft Wraps,"Soft fabric wraps for the AirFit F30i mask headgear.
Optional soft wraps can help add softness and comfort at the cheeks.Please note. Soft wraps only. No mask or frame included.",15.00,Home > Sleep apnea > CPAP Accessories > CPAP Mask Cushions > ResMed AirFit™ F30i Soft Wraps,https://shop.resmed.com.au/resmed-airfit-f30i-soft-wraps/,False,4.2,8,Soft Wraps|Sleep Apnea|CPAP Mask Cushions|ResMed AirFit™ F30i,Accessory
Sleep apnea,SKU:63372,ResMed AirFit™ F30i Mask Headgear,"Replacement headgear for the AirFit F30i full face CPAP mask.
Time to replace the headgear on your AirFit F30i mask?There's no need to buy a whole new mask, simply replace worn parts to save money and reduce waste.",85.00,Home > Sleep apnea > CPAP Accessories > CPAP Mask Headgear > ResMed AirFit™ F30i Mask Headgear,https://shop.resmed.com.au/resmed-airfit-f30i-mask-headgear/,False,4.5,2,Headgear|Sleep Apnea|CPAP|AirFit F30i,Accessory
Sleep apnea,,ResMed AirFit™ F30i (frame only),"Replacement frame for the AirFit F30i full face CPAP mask.
Time to replace the frame on your AirFit F30i CPAP mask?Don't buy a whole new mask, simply replace worn parts to save money and reduce waste.",159.00,Home > Sleep apnea > CPAP Accessories > CPAP Mask Headgear > ResMed AirFit™ F30i (frame only),https://shop.resmed.com.au/resmed-airfit-f30i-frame/,False,3.0,2,Frame|Sleep Apnea|CPAP|AirFit F30i,Accessory
Sleep apnea,,ResMed AirFit™ F30i Full Face Cushion,"Replacement cushion for the ResMed Airfit F30i full face mask
Don't buy a whole new mask, simply replace the nasal cushion to save money and reduce waste.",89.00,Home > Sleep apnea > CPAP Accessories > CPAP Mask Cushions > ResMed AirFit™ F30i Full Face Cushion,https://shop.resmed.com.au/resmed-airfit-f30i-full-face-cushion/,False,4.2,6,Cushion|Sleep Apnea|ResMed AirFit™ F30i|Full Face Mask|CPAP Mask Cushions,Accessory
Sleep apnea,SKU:BND191,Cleaning Pack,"CPAP cleaning pack includes: 62 wipes tub, and CPAP soap
Stay on top of your CPAP cleaning with this convenient cleaning pack.Wipe your mask daily, and wash your equipment with the CPAP soap weekly.",18.50,Home > Sleep apnea > CPAP Accessories > CPAP Cleaning > Cleaning Pack,https://shop.resmed.com.au/cleaning-pack/,False,4.6,19,Cleaning Pack|CPAP Cleaning|CPAP Soap|CPAP Wipes|Sleep Apnea,Accessory
Sleep apnea,SKU:38843,ResMed F20/F30 Connector for AirMini™,"The AirMini F20/F30 connector enables you to connect your ResMed AirFit™ F20, AirTouch™ F20 or AirFit F30 mask to the ResMed AirMini CPAP machine. It includes an AirMini F20/F30 connector only, which connects the mask to the AirMini tubing. AirMini tubing is not included.
",30.00,Home > Sleep apnea > CPAP Accessories > CPAP Mask Parts > ResMed F20/F30 Connector for AirMini™,https://shop.resmed.com.au/resmed-airfit-f20-f30-connector-for-airmini/,True,4.6,7,Connector|AirMini|AirFit|AirTouch|CPAP,Accessory
Sleep apnea,SKU:38844,ResMed N20 Connector for AirMini™,"The AirMini N20 connector enables you to connect your ResMed AirFit™ N20, AirFit N20 Classic or AirTouch™ N20 mask to the ResMed AirMini CPAP machine. It includes an AirMini N20 connector only and connects the mask to the AirMini tubing. AirMini tubing is not included.
",35.00,Home > Sleep apnea > CPAP Accessories > CPAP Mask Parts > ResMed N20 Connector for AirMini™,https://shop.resmed.com.au/resmed-airfit-n20-connector-for-airmini/,True,4.3,6,Connector|AirMini|ResMed|AirFit|AirTouch|Sleep Apnea,Accessory
Sleep apnea,SKU:38845,ResMed P10 Connector for AirMini™,"The AirMini P10 connector enables you to connect your ResMed AirFit™ P10 or AirFit P10 for Her mask to the ResMed AirMini CPAP machine. It includes the AirMini compatible AirFit P10 frame and vent only. AirMini tubing is not included.
",80.00,Home > Sleep apnea > CPAP Accessories > CPAP Mask Parts > ResMed P10 Connector for AirMini™,https://shop.resmed.com.au/resmed-p10-connector-for-airmini/,False,4.7,6,Connector|AirMini|AirFit P10|ResMed|CPAP,Accessory
Sleep apnea,SKU:38880,ResMed N30 Connector for AirMini™,"The N30 connector enables you to connect your ResMed AirFit™ N30 nasal cradle mask to the ResMed AirMini CPAP machine. It includes the AirMini compatible AirFit N30 frame and vent only. AirMini tubing is not included.
",80.00,Home > Sleep apnea > CPAP Accessories > CPAP Mask Parts > ResMed N30 Connector for AirMini™,https://shop.resmed.com.au/resmed-n30-connector-for-airmini/,False,3.0,3,Connector|AirMini|AirFit|N30|CPAP,Accessory
Sleep apnea,SKU:37394,ResMed Airsense10 Tubing Elbow,"
",9.95,Home > Sleep apnea > CPAP Accessories > CPAP Mask Parts > ResMed Airsense10 Tubing Elbow,https://shop.resmed.com.au/resmed-airsense10-tubing-elbow/,False,0.0,0,Tubing Elbow|Sleep Apnea|ResMed Airsense10,Accessory
Sleep apnea,SKU:38822,ResMed AirMini Tubing,"Replacement tubing for the ResMed AirMini. Length is 1.9 m with an inner diameter of 15 mm.
Replacement tubing for the ResMed AirMini. Length is 1.9 m with an inner diameter of 15 mm.ALWAYS READ THE LABEL AND FOLLOW THE INSTRUCTIONS FOR USE. IF SYMPTOMS PERSIST, TALK TO YOUR HEALTHCARE PROFESSIONAL.CPAP TUBES✓✓     XX✓✓ X✓XXX✓Resmed Airmini OnlyResmed S9 Series Only",20.00,Home > Sleep apnea > CPAP Accessories > Tubing > ResMed AirMini Tubing,https://shop.resmed.com.au/resmed-airmini-tubing/,False,4.9,7,Tubing|ResMed AirMini|Sleep Apnea|CPAP Accessories,Accessory
Sleep apnea,,ResMed AirTouch™ N20 for Her Starter Pack,"AirTouch N20 for Her is an AirTouch N20 mask variant that's designed in a smaller size and with unique styling to better meet the needs of women. This starter pack contains 1 x AirTouch N20 for Her nasal mask system and 2 x UltraSoft™ memory foam cushions (3 months' supply). This mask is size Small.
Description:ResMed's AirTouch N20 represents our softest nasal mask ever – with UltraSoft memory foam cushion designed to offer unprecedented mask comfort.Key featuresSize optionsAirTouch N20 for Her Guides ",199.00,Home > Sleep apnea > CPAP Masks > Nasal Masks > ResMed AirTouch™ N20 for Her Starter Pack,https://shop.resmed.com.au/resmed-airtouch-n20-for-her-starter-pack/,False,4.8,6,Starter Pack|Sleep Apnea|Nasal Masks|AirTouch N20|UltraSoft Memory Foam,Product
Sleep apnea,SKU:7078905,ResMed Pure Liquid Soap,"
Ingredients: Fatty alcohol sulphate, sodium salt, Coconut diethanolamide, Cocoamido betaine, Alkyl polyglucoside, Glycerine, Bronopol (preservative)Caution: Keep out of reach of children, Seek medical advice if swallowed.",7.70,Home > Sleep apnea > CPAP Accessories > CPAP Cleaning > ResMed Pure Liquid Soap,https://shop.resmed.com.au/resmed-pure-liquid-soap/,False,4.9,9,Liquid Soap|Coconut Diethanolamide|Cocoamido Betaine|Alkyl Polyglucoside|Glycerine|Bronopol,Accessory
Sleep apnea,SKU:64159,ResMed AirFit - F30 - Frame (Standard),"
",95.00,Home > Sleep apnea > CPAP Accessories > CPAP Mask Headgear > ResMed AirFit - F30 - Frame (Standard),https://shop.resmed.com.au/resmed-airfit-f30-frame-standard/,False,0.0,0,Headgear|Sleep Apnea|CPAP|ResMed|AirFit|F30|Frame|Standard,Accessory
Sleep apnea,SKU:38878,AirFit™ N30 for AirMini™ Mask Pack,"This ResMed AirFit N30 mask is compatible with your ResMed AirMini CPAP machine. This pack includes HumidX heat and moisture exchangers for waterless humidification, AirMini flexible tubing and an AirFit N30 for AirMini mask.
Description:AirFit N30 is a CPAP mask that is designed to fit your lifestyle. It's ResMed's lightest mask ever* and features a soft, curved nasal cradle cushion and adjustable QuickFit™ elastic slip-on headgear. It includes three cushion sizes, SW, S and M, for your convenience.Key features:AirFit N30 for AirMini guides:",310.00,Home > Sleep apnea > CPAP Masks > Nasal Cradle Masks > AirFit™ N30 for AirMini™ Mask Pack,https://shop.resmed.com.au/airfit-n30-for-airmini-mask-pack/,True,3.7,3,AirFit N30|AirMini|CPAP Masks|Sleep Apnea|HumidX,Product
Sleep apnea,SKU:33963,ResMed Tubing Wrap,"A smooth, heat-retaining cover for your standard tube. Reduces rainout and minimises drag on your bedclothes and your mask to provide a more stable seal and a more comfortable experience.
ResMed's Tube Wrap is made from microfibre, has a soft, fleecy feel, and keeps the warmth in the tube from machine to mask, minimising """"rain out"""" on those cold nights.Why would I buy one?Tube Wrap maintains hose temperature above room temperature by insulating the hose, which reduces the amount of condensation within the tube.Tube Wrap cloth cover softens the contact between the skin and the tubingTube Wrap hides the """"medical"""" appearance of the CPAP tubing.Zipper and Velcro end seal keeps Tube Wrap in place and effective.ALWAYS READ THE LABEL AND FOLLOW THE INSTRUCTIONS FOR USE. IF SYMPTOMS PERSIST, TALK TO YOUR HEALTHCARE PROFESSIONAL.",49.95,Home > Sleep apnea > CPAP Accessories > Tubing > ResMed Tubing Wrap,https://shop.resmed.com.au/resmed-tubing-wrap/,False,4.6,8,Tubing Wrap|Sleep Apnea|CPAP Accessories|Microfibre|Heat Retaining|Rainout|Zipper|Velcro,Accessory
Sleep apnea,SKU:38010,AirMini™ F30 Setup Pack (No Mask),"This setup pack enables you to connect your ResMed AirFit™ F30 mask to the ResMed AirMini CPAP machine. It includes an AirMini F20/F30 connector and flexible AirMini tubing.
ALWAYS READ THE LABEL AND FOLLOW THE INSTRUCTIONS FOR USE. IF SYMPTOMS PERSIST, TALK TO YOUR HEALTHCARE PROFESSIONAL.",60.00,Home > Sleep apnea > CPAP Accessories > CPAP Mask Parts > AirMini™ F30 Setup Pack (No Mask),https://shop.resmed.com.au/airmini-f30-setup-pack-no-mask/,False,4.0,1,Setup Pack|AirMini|F30|CPAP|Sleep Apnea,Accessory
Sleep apnea,,ResMed AirTouch™ N20 Starter Pack,"This starter pack contains 1 x AirTouch N20 nasal mask system and 2 x UltraSoft™ memory foam cushions (3 months' supply).
Description:ResMed's AirTouch N20, with its UltraSoft memory foam cushion, is our softest nasal mask ever. It's designed to offer unprecedented mask comfort and ease-of-use.Key featuresSize optionsAirTouch N20 GuidesALWAYS READ THE LABEL AND FOLLOW THE INSTRUCTIONS FOR USE. IF SYMPTOMS PERSIST, TALK TO YOUR HEALTHCARE PROFESSIONAL.",199.00,Home > Sleep apnea > CPAP Masks > Nasal Masks > ResMed AirTouch™ N20 Starter Pack,https://shop.resmed.com.au/resmed-airtouch-n20-starter-pack/,False,4.4,9,Starter Pack|Sleep Apnea|Nasal Masks|AirTouch N20|UltraSoft Memory Foam,Product
Sleep apnea,SKU:38013,HumidX™ F20 (6 Pack),"6 pack of HumidX capsules for AirFit™ F20 or AirTouch™ F20 full face masks. Each one provides waterless humidification when used with a ResMed AirMini™ CPAP machine.
Description:HumidX heat moisture exchangers (HME) are designed to provide you with waterless humidification when you're using therapy.They work by capturing heat and moisture within tiny paper ridges when you exhale. They then release this heat and moisture to humidify the air when you inhale.Each pack contains 6 HumidX F20 capsules for use.ALWAYS READ THE LABEL AND FOLLOW THE INSTRUCTIONS FOR USE. IF SYMPTOMS PERSIST, TALK TO YOUR HEALTHCARE PROFESSIONAL.",59.00,Home > Sleep apnea > CPAP Accessories > Humidifiers > HumidX™ F20 (6 Pack),https://shop.resmed.com.au/humidx-f20-6-pack/,False,4.4,17,HumidX™|F20|CPAP|Sleep Apnea|Humidifiers,Accessory
Sleep apnea,,ResMed AirTouch™ N20 Mask Cushion (Single),"Replacement UltraSoft™ memory foam cushion for ResMed's AirTouch N20 nasal mask. This soft, breathable memory foam cushion is also compatible with the AirFit™ N20 nasal mask frame. Single cushion only.
Description: AirTouch N20 nasal mask brings a new level of comfort to sleep apnea therapy. Its replaceable cushion is designed to adapt to the unique contours of your face for an individualised and comfortable fit that’s also secure. Its memory foam also minimises contact pressure on your skin to help reduce the likelihood of skin irritation, soreness and red marks around the nasal bridge. For easy maintenance and optimum comfort, the AirTouch UltraSoft memory foam cushion is designed to be replaced monthly.Try out the UltraSoft memory foam cushion and experience the difference.Size options:AirTouch N20 Guides",29.00,Home > Sleep apnea > CPAP Accessories > CPAP Mask Cushions > ResMed AirTouch™ N20 Mask Cushion (Single),https://shop.resmed.com.au/resmed-airtouch-n20-mask-cushion-single/,False,4.3,9,Cushion|Sleep Apnea|AirTouch|UltraSoft|Memory Foam,Accessory
Sleep apnea,,ResMed AirTouch™ N20 Cushion (3 Pack),"Pack of 3 x UltraSoft™ memory foam cushions for ResMed's AirTouch N20 or AirFit™ N20 nasal masks.
Description:AirTouch N20 nasal mask is designed to adapt to the unique contours of your face for an individualised and comfortable fit. Its memory foam also minimises contact pressure on your skin to help reduce the likelihood of skin irritation, soreness and red marks around the nasal bridge.The disposable AirTouch UltraSoft memory foam cushion should be replaced monthly to maintain optimum comfort.This pack includes 3 x UltraSoft memory foam cushions and can be used with the AirFit N20 nasal mask frame.Size optionsAirTouch N20 Guides",69.00,Home > Sleep apnea > CPAP Accessories > CPAP Mask Cushions > ResMed AirTouch™ N20 Cushion (3 Pack),https://shop.resmed.com.au/resmed-airtouch-n20-cushion-3-pack/,False,4.3,47,Cushion|Sleep Apnea|AirTouch|UltraSoft|Memory Foam|AirFit,Accessory
Sleep apnea,SKU:38011,AirMini™ F20 Setup Pack (No Mask),"This setup pack enables you to connect your ResMed AirFit™ F20 or AirTouch™ F20 mask to the ResMed AirMini CPAP machine. It includes an AirMini F20/F30 Connector, HumidX™ F20 and flexible AirMini tubing.
ALWAYS READ THE LABEL AND FOLLOW THE INSTRUCTIONS FOR USE. IF SYMPTOMS PERSIST, TALK TO YOUR HEALTHCARE PROFESSIONAL.",67.50,Home > Sleep apnea > CPAP Accessories > CPAP Mask Parts > AirMini™ F20 Setup Pack (No Mask),https://shop.resmed.com.au/airmini-f20-setup-pack-no-mask/,False,4.8,5,Setup Pack|HumidX™ F20|AirMini™ F20|AirTouch™ F20|CPAP Machine|Sleep Apnea,Accessory
Sleep apnea,,REMZzz Nasal Padded Liners for ResMed and Fisher Paykel Masks (SAMPLE 6 pack),"
",,Home > Sleep apnea > CPAP Accessories > CPAP Mask Cushions > REMZzz Nasal Padded Liners for ResMed and Fisher Paykel Masks (SAMPLE 6 pack),https://shop.resmed.com.au/remzzz-nasal-padded-liners-for-resmed-and-fisher-paykel-masks-sample-6-pack/,False,1.0,2,Liners|Sleep Apnea|CPAP|REMZzz|ResMed|Fisher Paykel,Accessory
Sleep apnea,SKU:38012,HumidX™ F20 (3 Pack),"3 pack of HumidX capsules for AirFit™ F20 or AirTouch™ F20 full face masks. Each one provides waterless humidification when used with a ResMed AirMini™ CPAP machine.
Description:HumidX heat moisture exchangers (HME) are designed to provide you with waterless humidification when you're using therapy.They work by capturing heat and moisture within tiny paper ridges when you exhale. They then release this heat and moisture to humidify the air when you inhale.Each pack contains 3 HumidX F20 capsules for use.ALWAYS READ THE LABEL AND FOLLOW THE INSTRUCTIONS FOR USE. IF SYMPTOMS PERSIST, TALK TO YOUR HEALTHCARE PROFESSIONAL.",35.00,Home > Sleep apnea > CPAP Accessories > Humidifiers > HumidX™ F20 (3 Pack),https://shop.resmed.com.au/humidx-f20-3-pack/,False,3.5,4,HumidX™|HME|Heat Moisture Exchangers|CPAP Accessories|Sleep Apnea,Accessory
Sleep apnea,SKU:7ANPS,REMZzz Nasal Pillow Padded Liners (SAMPLE 6 pack),"
",15.00,Home > Sleep apnea > CPAP Accessories > CPAP Mask Cushions > REMZzz Nasal Pillow Padded Liners (SAMPLE 6 pack),https://shop.resmed.com.au/remzzz-nasal-pillow-padded-liners-sample-6-pack/,False,0.0,0,Nasal Pillow|Padded Liners|Sleep Apnea|REMZzz|CPAP Mask Cushions,Accessory
Sleep apnea,,REMZzz Nasal Padded Liners for Philips Masks (SAMPLE 6 pack),"
",,Home > Sleep apnea > CPAP Accessories > CPAP Mask Cushions > REMZzz Nasal Padded Liners for Philips Masks (SAMPLE 6 pack),https://shop.resmed.com.au/remzzz-nasal-padded-liners-for-philips-masks-sample-6-pack/,False,0.0,0,Nasal Padded Liners|Philips Masks|REMZzz|Sleep Apnea|CPAP Accessories,Accessory
Sleep apnea,SKU:37310,ResMed Airsense10 Air Outlet,"
",9.95,Home > Sleep apnea > CPAP Accessories > CPAP Machine Parts > ResMed Airsense10 Air Outlet,https://shop.resmed.com.au/resmed-airsense10-air-outlet/,False,5.0,2,Air Outlet|Sleep Apnea|ResMed|CPAP Machine Parts,Accessory
Sleep apnea,SKU:36851,Filters for ResMed S9™ and AirSense™ 10 (2 Pack),"
",5.90,Home > Sleep apnea > CPAP Accessories > CPAP Filters > Filters for ResMed S9™ and AirSense™ 10 (2 Pack),https://shop.resmed.com.au/filters-for-resmed-s9-and-airsense-10-2-pack/,False,4.3,45,Filters|ResMed S9|AirSense 10|Sleep Apnea,Accessory
