category,sku,product,description,price,breadcrumb,product_url,money_back,rating,total_reviews,tags,type
Sleep apnea,,ResMed Gecko Nasal Pad,"Hypoallergenic, latex-free and fully washable, helps to reduce facial sores and mask leaks and improve overall comfort.
These comfortable soft strips are placed across the nasal bridge to help reduce skin irritation and facial sores, minimize mask leak and improve overall mask comfort. Each pad lasts about a month. Daily cleaning required. The Gecko Pads are made from polymer gel composed of USP grade mineral oil. They are non-toxic, fully washable, hypoallergenic. They do not contain natural rubber latex, or silicone. Available in Large and Small sizes. Suitable for nasal and full face masks. ",25.00,Home > Sleep apnea > CPAP Accessories > CPAP Mask Cushions > ResMed Gecko Nasal Pad,https://shop.resmed.com.au/resmed-gecko-nasal-pad/,False,2.9,15,Nasal Pad|Hypoallergenic|Latex-Free|Washable|Facial Sores|Mask Leaks|Comfort|USP Grade Mineral Oil|Non-Toxic|Silicone|Large|Small|Nasal|Full Face Masks,Accessory
Sleep apnea,SKU:61294,ResMed Elbow Assembly for Quattro CPAP Mask,"Replacement Elbow Assembly for ResMed Quattro Mirage Full Face Mask.
",39.00,Home > Sleep apnea > CPAP Accessories > CPAP Mask Parts > ResMed Elbow Assembly for Quattro CPAP Mask,https://shop.resmed.com.au/resmed-elbow-assembly-for-quattro-cpap-mask/,False,0.0,0,Elbow Assembly|Sleep Apnea|CPAP Mask|Quattro|ResMed,Accessory
Sleep apnea,SKU:38823,ResMed AirMini™ N20 Setup Kit (No Mask),"This setup pack enables you to connect your ResMed AirFit™ N20, AirFit N20 Classic or AirTouch™ N20 mask to the ResMed AirMini CPAP machine. It includes an AirMini N20 Connector, HumidX and HumidX Plus, and flexible AirMini tubing.
ALWAYS READ THE LABEL AND FOLLOW THE INSTRUCTIONS FOR USE. IF SYMPTOMS PERSIST, TALK TO YOUR HEALTHCARE PROFESSIONAL.",75.00,Home > Sleep apnea > CPAP Accessories > CPAP Mask Parts > ResMed AirMini™ N20 Setup Kit (No Mask),https://shop.resmed.com.au/resmed-airmini-n20-setup-kit/,True,0.0,0,Setup Kit|HumidX|HumidX Plus|AirMini Tubing|Sleep Apnea|CPAP Mask Parts,Accessory
Sleep apnea,SKU:61531,ResMed Swift™ FX Mask Backstrap,"Replacement Back Strap for ResMed Swift FX Nasal Pillows Mask.
Replacement backstrap for Swift FX headgear. ",40.00,Home > Sleep apnea > CPAP Accessories > CPAP Mask Headgear > ResMed Swift™ FX Mask Backstrap,https://shop.resmed.com.au/resmed-swift-fx-backstrap/,False,3.3,3,Backstrap|Sleep Apnea|CPAP Mask|ResMed Swift™ FX,Accessory
Sleep apnea,SKU:61581,ResMed Swift™ FX Bella Mask Headgear Assembly,"Replacement Headgear Assembly for ResMed Swift FX Bella Nasal Pillows Mask.
Replacement Swift FX Bella headgear loops that wrap easily and gently around your ears, the Bella is simple to wear and easy to adjust. ",110.00,Home > Sleep apnea > CPAP Accessories > CPAP Mask Headgear > ResMed Swift™ FX Bella Mask Headgear Assembly,https://shop.resmed.com.au/resmed-swift-fx-bella-headgear-assembly/,False,0.0,0,Headgear|Sleep Apnea|CPAP Mask|Swift FX|Bella,Accessory
Sleep apnea,SKU:61282,ResMed Quattro™ Mask Elbow,"Replacement Elbow for ResMed Quattro Mask series.
",15.00,Home > Sleep apnea > CPAP Accessories > CPAP Mask Parts > ResMed Quattro™ Mask Elbow,https://shop.resmed.com.au/resmed-quattro-elbow/,False,3.0,1,Elbow|Sleep Apnea|CPAP|Quattro Mask,Accessory
Sleep apnea,SKU:62110,ResMed Mirage FX™ Mask Headgear,"Replacement headgear for Mirage FX
Mirage FX features a form-fitting SoftEgde headgear which is flexible and light, with a contoured edge that's kind to your face. ",85.00,Home > Sleep apnea > CPAP Accessories > CPAP Mask Headgear > ResMed Mirage FX™ Mask Headgear,https://shop.resmed.com.au/mirage-fx-headgear/,False,4.0,2,Headgear|Sleep Apnea|CPAP Mask|ResMed|Mirage FX,Accessory
Sleep apnea,,REMZzz Nasal Padded Liners for Philips Masks,"RemZzz will help you and your mask become friends and acts as a barrier between the skin of your face and the silicone of your mask's cushion, virtually eliminating all of the most common problems associated with wearing a CPAP mask. And best of all, it's very comfortable! This pack includes liners for 30 nights.
RemZzz will help you and your mask become friends and acts as a barrier between the skin of your face and the silicone of your mask's cushion, virtually eliminating all of the most common problems associated with wearing a CPAP mask. And best of all, it's very comfortable! This pack includes liners for 30 nights.",50.00,Home > Sleep apnea > CPAP Accessories > CPAP Mask Cushions > REMZzz Nasal Padded Liners for Philips Masks,https://shop.resmed.com.au/remzzz-nasal-padded-liners-for-philips-masks/,False,4.0,1,Liners|CPAP Mask|Sleep Apnea|REMZzz|Philips Masks,Accessory
Sleep apnea,SKU:61529,ResMed Swift™ FX Mask Headgear,"Replacement headgear for ResMed Swift FX Nasal Pillows Mask.
Replacement headgear for the Swift FX Nasal Pillows mask that's easy to adjust. Once you set the straps to your fit they stay put where you want them. ",110.00,Home > Sleep apnea > CPAP Accessories > CPAP Mask Headgear > ResMed Swift™ FX Mask Headgear,https://shop.resmed.com.au/resmed-swift-fx-headgear/,False,4.0,1,Headgear|Sleep Apnea|CPAPMask|Swift FX|Nasal Pillows,Accessory
Sleep apnea,SKU:62936,ResMed AirFit™ P10 for Her Mask Headgear,"Replacement pink “for Her” adjustable QuickFit™ headgear for the AirFit P10 or AirFit P10 for Her nasal pillows mask.
The adjustable QuickFit™ elastic headgear is designed to make AirFit P10 for Her easy to fit and adjust at home. The new single side-clip on the headgear provides added adjustability if needed. ",60.00,Home > Sleep apnea > CPAP Accessories > CPAP Mask Headgear > ResMed AirFit™ P10 for Her Mask Headgear,https://shop.resmed.com.au/resmed-airfit-p10-mask-headgear-for-her/,False,4.1,11,Headgear|Sleep Apnea|CPAP Mask|QuickFit|AirFit P10,Accessory
Sleep apnea,,ResMed AirFit™ P10 Mask Cushion,"These nasal pillow inserts are colour coded and have left and right orientation for quick and easy fitting.
",70.00,Home > Sleep apnea > CPAP Accessories > CPAP Mask Cushions > ResMed AirFit™ P10 Mask Cushion,https://shop.resmed.com.au/resmed-airfit-p10-pillow-insert/,False,4.3,19,Cushion|Sleep Apnea|CPAP|ResMed AirFit™ P10,Accessory
Sleep apnea,SKU:28226,ResMed Lumis™ 150 VPAP ST-A ventilator,"Lumis 150 VPAP ST-A is one of a series of ventilators for people with respiratory conditions who can breathe spontaneously but not efficiently enough. The Lumis 150 VPAP ST-A is easy to set up and use and features built-in wireless connectivity.*
Responds to your needsTwo therapy modes provide personalised ventilation to support your respiratory condition and automatically adapt to your changing needs while giving you the opportunity to breathe spontaneously.Comfortable, user friendly designEasy to navigate and use, Lumis can gradually and comfortably ramp the pressure up to your prescribed level, and down again at the end of the therapy session.Consistent humidificationWhen used with a HumidAir™ heated humidifier and ClimateLineAir™ heated tube, Lumis delivers humidification automatically. ",,Home > Sleep apnea > CPAP Machines > Bilevels and Bipaps > ResMed Lumis™ 150 VPAP ST-A ventilator,https://shop.resmed.com.au/resmed-lumis-150-vpap-st-a-ventilator/,False,0.0,0,Ventilator|Sleep Apnea|HumidAir|ClimateLineAir|Bilevels|Bipaps,Product
Sleep apnea,,ResMed AirFit™ F20 for Her Full Face Mask,"The ResMed AirFit F20 for Her full face mask is the female version of the AirFit F20. Designed specifically to give women a more personalised mask that better meets her unique facial features and adapts to the way she sleeps.
Key FeaturesSize OptionsAirFit F20 for Her GuidesALWAYS READ THE LABEL AND FOLLOW THE INSTRUCTIONS FOR USE. IF SYMPTOMS PERSIST, TALK TO YOUR HEALTHCARE PROFESSIONAL.",229.00,Home > Sleep apnea > CPAP Masks > Full Face Masks > ResMed AirFit™ F20 for Her Full Face Mask,https://shop.resmed.com.au/resmed-airfit-f20-for-her-full-face-mask/,True,3.8,16,Full Face Mask|Sleep Apnea|ResMed AirFit™ F20|Size Options|AirFit F20 for Her Guides,Product
Sleep apnea,SKU:37438,ResMed AirCurve™ 10 CS PaceWave™ ASV Machine,"This adaptive servo-ventilator is specifically designed for people with breathing problems like central sleep apnea or a mixture of obstructive, central sleep apnea and/or periodic breathing. It features built-in wireless connectivity, enabling your health care practitioner to monitor your progress.
Adapts to your needs. The AirCurve 10 CS PaceWave can rapidly stabilise your breathing and blood oxygen levels, helping to improve sleep quality.Easy-Breathe pressure waveform mimics the wave shape of your normal breathing and replicates it for your breathing comfort. The AirCurve 10 CS PaceWave has a HumidAir™ humidifier and a ClimateLineAir™ heated air tube which are designed to automatically deliver optimal temperature and humidity, for a more comfortable experience.Call 1800 737 633 for more information.ALWAYS READ THE LABEL AND FOLLOW THE INSTRUCTIONS FOR USE. IF SYMPTOMS PERSIST, TALK TO YOUR HEALTHCARE PROFESSIONAL. ContraindicationsIf you suffer from any of the following pre-existing conditions please consult your doctor before using this device:It's recommended to read the  before using this device.",,Home > Sleep apnea > CPAP Machines > Bilevels and Bipaps > ResMed AirCurve™ 10 CS PaceWave™ ASV Machine,https://shop.resmed.com.au/resmed-aircurve-10-cs-pacewave-bi-level-machine/,True,0.0,0,Sleep Apnea|CPAP Machines|Bilevels|Bipaps|AirCurve 10 CS PaceWave|HumidAir|ClimateLineAir,Product
Sleep apnea,,ResMed Quattro™ FX Mask Headgear,"Replacement Headgear for ResMed Quattro FX Full Face Mask.
The Quattro FX's headgear is simple to fit on with a set-it-and-forget-it feature that keeps your settings in place saving you the hassle of constant adjustment before starting your therapy every night. ",79.00,Home > Sleep apnea > CPAP Accessories > CPAP Mask Headgear > ResMed Quattro™ FX Mask Headgear,https://shop.resmed.com.au/resmed-quattro-fx-mask-headgear/,False,4.8,5,Headgear|Sleep Apnea|CPAPMask|Quattro FX|ResMed,Accessory
Sleep apnea,SKU:38809,ResMed HumidX™ (3 Pack),"3 pack of HumidX capsules for use with AirMini™ compatible AirFit™ nasal and nasal pillows mask systems. Each one provides waterless humidification when used with a ResMed AirMini CPAP machine.
HumidX are small heat and moisture exchangers (HME) designed to provide you with a comfortable experience at home or on holiday.You can use HumidX in almost any climate or sleep environment.When you exhale, heat and moisture is stored within the HME's tiny paper ridges. When you inhale, this heat and moisture is released to humidify the air you breathe in.Each pack contains 3 capsules for use.ALWAYS READ THE LABEL AND FOLLOW THE INSTRUCTIONS FOR USE. IF SYMPTOMS PERSIST, TALK TO YOUR HEALTHCARE PROFESSIONAL.",35.00,Home > Sleep apnea > CPAP Accessories > Humidifiers > ResMed HumidX™ (3 Pack),https://shop.resmed.com.au/resmed-humidx-3-pack/,False,3.3,3,HumidX|Sleep Apnea|CPAP Accessories|Heat and Moisture Exchangers|HME,Accessory
Sleep apnea,SKU:62114,ResMed Mirage™ FX Mask Elbow,"Replacement Elbow Assembly for ResMed Mirage FX Mask.
The Mirage FX features a quick-release elbow that detaches from your device without the need to remove your mask, allowing you to freely move in and out of bed and easily reconnect to your device when you want. ",29.00,Home > Sleep apnea > CPAP Accessories > CPAP Mask Parts > ResMed Mirage™ FX Mask Elbow,https://shop.resmed.com.au/mirage-fx-elbow/,False,4.4,5,Elbow|Sleep Apnea|CPAP|ResMed Mirage™ FX Mask,Accessory
Sleep apnea,SKU:63766,ResMed AirFit™ N20 Classic Mask Frame,"Replacement frame for the AirFit N20 Classic nasal mask.
The AirFit N20 Classic mask frame is designed to help you move freely during the night to provide you with uninterrupted therapy. ",75.00,Home > Sleep apnea > CPAP Accessories > CPAP Mask Parts > ResMed AirFit™ N20 Classic Mask Frame,https://shop.resmed.com.au/resmed-airfit-n20-classic-mask-frame/,False,3.3,3,Mask Frame|Sleep Apnea|AirFit N20|CPAP Accessories|ResMed,Accessory
Sleep apnea,SKU:63270,ResMed AirFit™ N10 Mask Frame,"Enjoy reading in bed with the innovative under-eye design of The AirFit N10 mask frame
The AirFit N10 mask frame has been designed to leave a clear line of sight so you can enjoy reading or watching TV in bed as your therapy ramps up. (With optional fabric soft sleeves.)",85.00,Home > Sleep apnea > CPAP Accessories > CPAP Mask Headgear > ResMed AirFit™ N10 Mask Frame,https://shop.resmed.com.au/airfit-n10-mask-frame/,False,3.7,3,Mask Frame|Sleep Apnea|AirFit N10|CPAP Mask Headgear|Soft Sleeves,Accessory
Sleep apnea,,ResMed Swift™ FX Mask Cushion,"Replacement Pillow for ResMed Swift FX Nasal Pillows Mask.
Move freely while you sleep - these replacement Swift FX pillows cushions are ultra-soft for a stable yet gentle fit and they attach to your device tubing with a flexible joint that doesn’t limit your movements. ",89.00,Home > Sleep apnea > CPAP Accessories > CPAP Mask Cushions > ResMed Swift™ FX Mask Cushion,https://shop.resmed.com.au/resmed-swift-fx-pillow-cushions/,False,0.0,0,Cushion|Sleep Apnea|CPAP|Swift FX|Mask,Accessory
Sleep apnea,,ResMed AirFit™ N20 Mask Headgear,"Replacement headgear for AirFit N20 nasal mask. Available in Small, Standard and Large sizes.
The replacement headgear for the AirFit N20 is made with SoftEdge fabric that offers a comfortable fit and stability. ",65.00,Home > Sleep apnea > CPAP Accessories > CPAP Mask Headgear > ResMed AirFit™ N20 Mask Headgear,https://shop.resmed.com.au/resmed-airfit-n20-mask-headgear/,False,4.2,26,Headgear|Sleep Apnea|CPAP Mask|SoftEdge|AirFit N20,Accessory
Sleep apnea,SKU:63765,ResMed AirFit™ N20 Classic Mask Elbow,"Replacement classic elbow to connect the tubing to your AirFit N20 mask.
The elbow accessory is used to connect your device tubing to your mask. ",30.00,Home > Sleep apnea > CPAP Accessories > CPAP Mask Parts > ResMed AirFit™ N20 Classic Mask Elbow,https://shop.resmed.com.au/resmed-airfit-n20-classic-elbow/,False,0.0,0,Elbow|Sleep Apnea|CPAP Accessories|AirFit N20|Mask Parts,Accessory
Sleep health,,Bambi Cooltouch Pillow Protector,"Stay comfortable all year long with Bambi’s Cooltouch Active Flip Pillow Protector
Stay comfortable all year long with Bambi’s Cooltouch™ Active Flip Pillow Protector.This remarkable product is designed for all year-round comfort, as it features two different surfaces: on one side a silky soft TENCEL-blend fabric perfect for the cooler months and on the other, Bambi’s revolutionary CoolTouch Active fabric which gives cooling relief in the warmer months.This remarkable product has an upper layer of low heat-conducting natural MICA mineral fibres.Unlike many cooling products on the market, this product is not gel infused, rather the natural MICA mineral fibres are woven into the fabric, meaning the fabric stays cool to the touch, regardless of how many times it is used, or laundered.As you’d expect, the Flip Pillow Protector protects your pillow against stains, spills, dust mites and other nasties. It is also fully waterproof, asthma and allergy friendly and comes with Bambi’s 5 year product guarantee. The protector can be machine washed and tumble dried on a low heat.",39.00,Home > Sleep health > Pillows > Bambi Cooltouch Pillow Protector,https://shop.resmed.com.au/bambi-cooltouch-pillow-protector/,False,3.8,5,Pillow Protector|CoolTouch Active|MICA Mineral Fibres|Asthma and Allergy Friendly|5 Year Product Guarantee,Accessory
Sleep health,SKU:7078762,Contoured Eye Mask,"Block all light while you sleep with this comfortable contoured eye mask.
Block all light while you sleep with this comfortable eye mask.It's contoured so there’s no light leakage around your nose or pressure on your eyes.",20.00,Home > Sleep health > Fall Asleep Faster > Contoured Eye Mask,https://shop.resmed.com.au/contoured-eye-mask/,True,2.7,3,Eye Mask|Sleep Health|Light Block|Contoured|Fall Asleep Faster,Accessory
Sleep health,,Neptune Gravity Blanket,"The Neptune Blanket has been designed to have an even weight distribution. This allows it to apply deep pressure, in order to give you that 'hugged' feeling. The Neptune Blanket can be used in stressful situations or when you need to calm down and get some much needed rest.
The blanket is designed to be approximately 10% of your body weight. The non-toxic, environmentally friendly, glass beads provide the weight which is evenly distributed within the 7 layers of the Neptune blanket.The inner blankets are made with breathable cotton filled with a superior glass bead which keeps the blankets thin, quiet, safe and fully washable. With the smallest pocket squares the industry has to offer, the weight has extremely even distribution. The outer cover is created with the softest of ultra-plush minky which is very durable so you know that your blanket will last. There are three available weight selections: 5kg, 7kg and 9kg.WeightDimensions (cms)Weight Guide",239.00 - 259.00,Home > Sleep health > Fall Asleep Faster > Neptune Gravity Blanket,https://shop.resmed.com.au/neptune-blanket,True,0.0,0,Neptune Blanket|Weight|Sleep Health|Glass Beads|Ultra-Plush Minky|Fall Asleep Faster,Product
Snoring,SKU:7079314,BongoRx Starter Kit,"Bongo has been shown to reduce or eliminate snoring for most users, by keeping the airway open, and reducing vibration in a restricted airway, which is the main cause of the snoring noise. Can also treat mild to moderate Obstructive Sleep Apnea. Small enough to fit into a shirt pocket, great for travelling. No machine, hose or batteries needed.
The Bongo RX starter kit contains:1 x Clamshell Travel Case1 x Headgear4 Soft silicon nasal seals in Small, Medium, Large and Extra-Large sizes.Drying standCleaning Instructions:Clean the Bongo RX nasal seals with mild soap and water to extend the life and effectiveness of the device.After 90 days you will need to purchase a BongoRX Replenishment Kit.",279.00,Home > Sleep apnea > CPAP Alternatives > BongoRx Starter Kit,https://shop.resmed.com.au/bongorx-starter-kit/,False,2.4,5,Starter Kit|Snoring|BongoRX|EPAP|CPAP Alternatives,Product
Snoring,SKU:7079320,OptiPillows Starter Kit,"Optipillows is used to treat snoring and mild to moderate Obstructive Sleep Apnea. The only EPAP device that has adjustable pressures. Includes 3 cushion sizes, headgear and adjustable EPAP valve. For use at home or travelling
OptiPillows is an EPAP (Expiratory Positive Airway Pressure) nasal mask for the treatment of snoring but may also treat mild to moderate obstructive sleep apnea.How it works:During inspiration the valve opens allowing you to breathe in easily. When you exhale, the valve closes and redirects the expired air through a narrow opening on the side of the valve. This creates Expiratory Positive Airway Pressure (EPAP) in the mouth which helps keep the upper airways open and prevents snoring and sleep apnea. For better experience, expiratory pressure can be adjusted by rotating the sleeve to change expiratory resistance.",170.00,Home > Sleep apnea > CPAP Alternatives > OptiPillows Starter Kit,https://shop.resmed.com.au/optipillows-starter-kit/,True,1.5,2,Starter Kit|EPAP|Snoring|OptiPillows|Sleep Apnea|CPAP Alternatives|Adjustable Pressures|Expiratory Positive Airway Pressure,Product
Sleep health,,Sweet Dreams Light Bulb,"Create flicker free, high quality, warm evening lighting allowing your body to properly wind down and relax.
Standard household light bulbs that emit blue light can trick your brain into thinking it’s daytime.Replace them with Sweet Dreams Bulbs which delivers warm light to help facilitate sleep.Block blue light This allows your body to naturally wind down and produce melatonin (the sleep hormone) to prepare your body for a good night’s sleep.Comfortable, flicker-free, warm light These BlockBlueLight Sweet Dreams Bulbs utilises proprietary spectrum technology to deliver flicker free, high quality, warm evening lighting allowing you to properly wind down and relax. It may improve the quality and duration of sleep and supports the natural sleep cycle.Support your sleep-wake cycle Get your body clock in synch so you enjoy a restful night’s sleep and awake refreshed, ready to enjoy the day.For best results: Once the sun has set turn off any other artificial lighting and electronics and use the Sweet Dreams bulbs for optimal benefits.",29.00,Home > Sleep health > Lighting > Sweet Dreams Light Bulb,https://shop.resmed.com.au/sweet-dreams-light-bulb/,True,0.0,0,Sweet Dreams|Light Bulb|Sleep Health|Block Blue Light|Flicker Free,Accessory
Sleep health,,Blue Light Blocking Glasses Kids NightFall,"Advanced blue and green light blocking lenses designed for children for after-dark use. They block 99% of blue and green light.
Overexposure to high frequency blue and green light from digital devices and artificial lighting may damage the development of a child's eye sight.These glasses feature a Nocturnal Kids Lens - specially designed to be a lighter shade of red to allow more yellow, orange, and red light wavelengths through while still blocking blue and green wavelengths.",69.00,Home > Sleep health > Glasses > Blue Light Blocking Glasses Kids NightFall,https://shop.resmed.com.au/blkblulht-glasses-kids-nightfall/,True,0.0,0,Blue Light Blocking|Kids NightFall|Sleep Health|Nocturnal Kids Lens|99% Blocking,Accessory
Sleep apnea,,ResMed AirTouch™ F20 Starter Kit -  Mask System and 2 Foam Cushions,"This starter kit contains 1 x AirTouch F20 full face mask and 2 x UltraSoft memory foam cushions (3 months' supply).
The softest full face mask ResMed has ever designed and the first one to use UltraSoft memory foam. Its light, breathable cushion helps provide a secure seal across a range of therapy pressures.Key FeaturesSize OptionsWhat's in this starter kit?This starter kit contains 1 x AirTouch F20 full face mask and 2 x UltraSoft memory foam cushions (3 months’ supply).AirTouch F20 GuidesALWAYS READ THE LABEL AND FOLLOW THE INSTRUCTIONS FOR USE. IF SYMPTOMS PERSIST, TALK TO YOUR HEALTHCARE PROFESSIONAL.",199.00,Home > Sleep apnea > CPAP Masks > Full Face Masks > ResMed AirTouch™ F20 Starter Kit -  Mask System and 2 Foam Cushions,https://shop.resmed.com.au/resmed-airtouch-f20-starter-kit-mask-system-and-2-foam-cushions/,False,4.3,26,Starter Kit|Sleep Apnea|CPAP Masks|Full Face Masks|AirTouch F20|UltraSoft Memory Foam Cushions,Product
Sleep apnea,SKU:61528,ResMed Swift™ FX Mask Short Tubing Assembly,"Used to attach the tubing from your CPAP machine to your Swift FX mask. (Pack of one)
The short tube assembly is part of the Swift FX nasal mask.It is used to attach the tubing from your device to your mask.You can remove and replace the tube assembly from your mask by removing the ring from the cushion.Single pack.",69.00,Home > Sleep apnea > CPAP Accessories > Tubing > ResMed Swift™ FX Mask Short Tubing Assembly,https://shop.resmed.com.au/resmed-swift-fx-short-tubing-assembly/,False,4.0,1,Tubing|Sleep Apnea|Swift FX|ResMed|CPAP,Accessory
Sleep apnea,SKU:36810,ResMed SlimLine™ Tubing fits S9™ CPAP Machines,"Replacement slimline tube for the Resmed S9 series CPAP Machines
The SlimLine Tubing is one of our slimmest and most flexible tubes.It is designed to provide you with a seamless therapy experience by allowing you to move comfortably in your sleep.ALWAYS READ THE LABEL AND FOLLOW THE INSTRUCTIONS FOR USE. IF SYMPTOMS PERSIST, TALK TO YOUR HEALTHCARE PROFESSIONAL. FAQ'sQ: Does this tubing also fit ResMed Elite S8 cpap machine? A: Yes it will.  Q: Can this Slimline Tube be connected to a F&P Eson Nasal Mask? A: Yes Q: Will this tube be suitable for the ResMed AirSense 10 elite? A: Yes, without a humidifier in use.",21.00,Home > Sleep apnea > CPAP Accessories > Tubing > ResMed SlimLine™ Tubing fits S9™ CPAP Machines,https://shop.resmed.com.au/resmed-slimline-tubing-fits-s9-cpap-machines/,False,4.8,4,Tubing|SlimLine|ResMed|CPAP Machines|Sleep Apnea,Accessory
Sleep apnea,SKU:14994,ResMed Standard Tubing,"Standard, universal tubing with an inner diameter of 19 mm. Suitable for all ResMed CPAP therapy machines (except AirMini). Can also be used with machines from other manufacturers.
Our Standard Tubing is a non heated tube which can be used with all devices (except ResMed AirMini).ALWAYS READ THE LABEL AND FOLLOW THE INSTRUCTIONS FOR USE. IF SYMPTOMS PERSIST, TALK TO YOUR HEALTHCARE PROFESSIONAL.",18.00,Home > Sleep apnea > CPAP Accessories > Tubing > ResMed Standard Tubing,https://shop.resmed.com.au/resmed-standard-tubing/,False,4.2,6,Standard Tubing|ResMed|Sleep Apnea|CPAP Accessories|Tubing,Accessory
Sleep apnea,SKU:36811,ResMed SlimLine™ Tubing Wrap,"This smooth, heat-retaining cover for your standard tube reduces rainout and minimises drag on your bedclothes and your mask.
The SlimLine Tubing Wrap is a smooth, heat-retaining cover for the air tube that helps to make your therapy more comfortable.The sleek cover reduces drag on your clothes and on your mask for a peaceful and relaxing night's sleep.ALWAYS READ THE LABEL AND FOLLOWS THE INSTRUCTIONS FOR USE. IF SYMPTOMS PERSIST, TALK TO YOUR HEALTHCARE PROFESSIONAL.",49.95,Home > Sleep apnea > CPAP Accessories > Tubing > ResMed SlimLine™ Tubing Wrap,https://shop.resmed.com.au/resmed-slimline-tubing-wrap/,False,0.0,0,Tubing Wrap|Sleep Apnea|ResMed SlimLine™|Heat Retaining|Rainout,Accessory
