category,sku,product,description,price,breadcrumb,product_url,money_back,rating,total_reviews
Sleep Apnea,SKU:38815,ResMed AirMini™ Filters (2 Pack),"Block fine dust from entering your AirMini device with these disposable filters. Pack of two.
Keep your AirMini device clean by using these filters to block fine materials and larger particles from entering your machine.Sold as a pack of 2 filters. These standard air filters are only suitable for use with the ResMed AirMini device.These filters are disposable and aren't suitable for washing.",5.9,Home > Bestsellers > ResMed AirMini™ Filters (2 Pack),https://shop.resmed.com.au/resmed-airmini-filters-2-pack/,False,4.6,5
Bestsellers,SKU:Online Only,Reflux Relief Pillow,"Medcline Reflux Relief System offers a natural way to relieve symptoms of acid reflux. Designed for side sleepers this pillow has a gel-infused foam for added cooling comfort and a gentle padded incline to prevent sliding down at night.
This patented system puts you in a gently inclined sleeping position proven to improve symptoms of acid reflux.Dual component design Medical grade foam 3 sizes ALWAYS READ THE LABEL AND FOLLOW THE INSTRUCTIONS FOR USE. IF SYMPTOMS PERSIST, TALK TO YOUR HEALTHCARE PROFESSIONAL.",350,Home > Sleep Health > Pillows > Reflux Relief Pillow,https://shop.resmed.com.au/reflux-relief-pillow/,True,3.7,10
Bestsellers,SKU:CPAPILLOW,CPAP Pillow for Side Sleepers,"Comfortable pillow designed for CPAP users who sleep on their side and encourage easier breathing during Sleep Apnea therapy.
Comfortable pillow designed for CPAP users who sleep on their side and encourage easier breathing during Sleep Apnea therapy.",49.95,Home > Sleep Health > Pillows > CPAP Pillow for Side Sleepers,https://shop.resmed.com.au/cpap-pillow-for-side-sleepers/,True,4,64
Sleep Apnea,SKU:64206,ResMed AirFit™ N30 Nasal Cradle Mask,"Resmed Airfit N30 is a CPAP mask that discreetly fits into your lifestyle to help adjust to therapy. Designed to be low profile and silent this mask is for side sleepers who are adjusting to their CPAP therapy. One of Resmed's lightest masks that provides support and comfort using a soft under the nose cradle cushion and a slip-on headgear.
With its simple design and slip-on headgear, this mask aims to fit into your lifestyle with ease. And with its narrow profile, the cushion sits evenly under your nose, so it's a great option if you sleep on your side.Key FeaturesAirFit N30 guidesALWAYS READ THE LABEL AND FOLLOW THE INSTRUCTIONS FOR USE. IF SYMPTOMS PERSIST, TALK TO YOUR HEALTHCARE PROFESSIONAL.",249,Home > Sleep Apnea > CPAP Masks > Nasal Cradle Masks > ResMed AirFit™ N30 Nasal Cradle Mask,https://shop.resmed.com.au/resmed-airfit-n30-nasal-cradle-mask/,True,4.2,9
Sleep Health,SKU:RETIMER,Re-timer Light Therapy Glasses,"Re-timer, a portable light therapy glasses for people on the go. These glasses use unique UV-free, sleep-inducing lights to get your sleeping pattern balanced. Simply put them on for 30 minutes a day while you get your day started or use them later while you relax after work.
University developed and backed by 25 years of research, Re-Timer uses light therapy, to re-program your body's sleep schedule. Re-Timer glasses should be worn for 30 minutes a day. Travellers who need to combat jet lag, shift workers and people who suffer from the winter blues due to reduced exposure to natural light",299,Home > Sleep Health > Glasses > Re-timer Light Therapy Glasses,https://shop.resmed.com.au/re-timer-light-therapy-glasses/,True,5,1
Bestsellers,SKU:37296,ResMed ClimateLineAir™ Heated Tubing for AirSense™ 10,"For AirSense 10 CPAP machines. This heated tubing provides the optimal temperature and humidity for your comfort and virtually eliminates rainout.
The ClimateLineAir is a heated tube that is purpose-built for ResMed AirSense 10 devices.This heated tube is specially designed to provide you with the optimal temperature and humidity for your comfort and virtually eliminates rainout.ALWAYS READ THE LABEL AND FOLLOW THE INSTRUCTIONS FOR USE. IF SYMPTOMS PERSIST, TALK TO YOUR HEALTHCARE PROFESSIONAL.",69,Home > Bestsellers > ResMed ClimateLineAir™ Heated Tubing for AirSense™ 10,https://shop.resmed.com.au/resmed-climateline-tubing-for-airsense-10/,False,4.6,56
Sleep Apnea,,ResMed AirTouch™ N20 for Her Starter Pack,"AirTouch N20 for Her is an AirTouch N20 mask variant that's designed in a smaller size and with unique styling to better meet the needs of women. This starter pack contains 1 x AirTouch N20 for Her nasal mask system and 2 x UltraSoft™ memory foam cushions (3 months' supply). This mask is size Small.
Description:ResMed's AirTouch N20 represents our softest nasal mask ever – with UltraSoft memory foam cushion designed to offer unprecedented mask comfort.Key featuresSize optionsAirTouch N20 for Her Guides ",199,Home > Sleep Apnea > CPAP Masks > Nasal Masks > ResMed AirTouch™ N20 for Her Starter Pack,https://shop.resmed.com.au/resmed-airtouch-n20-for-her-starter-pack/,False,5,5
Sleep Apnea,,ResMed AirFit™ N30 Nasal Cradle Cushion,"Replacement cushion for the AirFit N30 nasal cradle mask.
Don't buy a whole new mask, simply replace the nasal cushion to save money and reduce waste.",85,Home > Sleep Apnea > CPAP Accessories > CPAP Mask Cushions > ResMed AirFit™ N30 Nasal Cradle Cushion,https://shop.resmed.com.au/resmed-airfit-n30-mask-cushion/,False,3.2,5
Snoring,SKU:7074846,Seatec SleepTight Chinstrap,"A gentle, effective way to ensure your mouth stays closed during CPAP or bi-level therapy with a nasal or pillow mask. This is a medium-sized chin restraint.
Help keep your mouth closed while you sleep. Probably the most stable of chin straps, the unique, multi strap design holds it securely in place, and gives lots of chin and lip support.What size do I need? Measure around your head, from under your chin to the crown of your head going just in front of your ears (above your forehead), and back to the starting point under your chin.Median Sizes are:Small fits where the chin to top of head measurement is around 54cm.Medium fits where the measurement is around 60cm.Large fits where the measurement is around 66cm.Further lesser or larger adjustment is available on each chin strap size. The circumferences shown are the medium size for each chin strap. Chin straps help to minimize the problems that occur if air leaks from you mouth whilst using nasal CPAP. These include: a dry mouth or the feeling of air bubbling through your lips as you go to sleep. Chin straps can also sometimes help prevent air swallowing (aerophagia) and the discomfort it causes.Q : Can you please advise washing instructions without damaging stretchiness ?A : Wash weekly in warm soapy water, rinse and dry but not in direct sunlight. The Seatec will stretch slightly over the first month. Q : Can we see a diagram how worn? A : It goes over your head and under your chin. Q : Does the Chinstrap go on outside of your CPAP mask or on the inside. In other words what goes on your face first? A : Mask, then chin strap Q : Will this item help reduce snoring if used by itself? A : This will reduce minor snoring if the snoring is caused by muscle relaxation. This is not a prescribed therapy for snoring or Sleep Apnea. If the snoring is consistent it is best to have a chat to your GP.",30,Home > Snoring > Chin Strap > Seatec SleepTight Chinstrap,https://shop.resmed.com.au/seatec-sleeptight-chinstrap/,False,3.7,26
Snoring,SKU:7074843,Seatec Chin and Mouth Strap,"A gentle, effective way to ensure your mouth stays closed during CPAP or bi-level therapy with a nasal or pillow mask. This is a small-sized chin & mouth restraint.
A gentle, effective way to ensure your mouth stays closed during CPAP or bi-level therapy with a nasal or pillow mask.What size do I need? Measure around your head, from under your chin to the crown of your head going just in front of your ears (above your forehead), and back to the starting point under your chin.Median Sizes are:Small fits where the chin to top of head measurement is around 54cm.Medium fits where the measurement is around 60cm.Large fits where the measurement is around 66cm.Further lesser or larger adjustment is available on each chin strap size. The circumferences shown are the medium size for each chin strap. Chin straps help to minimize the problems that occur if air leaks from you mouth whilst using nasal CPAP. These include: a dry mouth or the feeling of air bubbling through your lips as you go to sleep. Chin straps can also sometimes help prevent air swallowing (aerophagia) and the discomfort it causes.",30,Home > Snoring > Chin Strap > Seatec Chin and Mouth Strap,https://shop.resmed.com.au/seatec-chin-and-mouth-strap/,False,3.7,37
Sleep Apnea,SKU:62129,ResMed Mirage FX For Her Headgear,"Replacement headgear for her Miraage FX
Mirage FX for Her features a form-fitting SoftEgde headgear which is flexible and light, with a contoured edge that's kind to your face. It comes in a stylish pink colour, smaller in size, to best fit your face.",85,Home > Sleep Apnea > CPAP Accessories > CPAP Mask Headgear > ResMed Mirage FX For Her Headgear,https://shop.resmed.com.au/resmed-mirage-fx-for-her-headgear/,False,0,0
Sleep Apnea,SKU:63567,ResMed AirFit™ N20 for Her Mask Frame,"Replacement mask frame for AirFit N20 (for Her) Nasal Mask.
This is a replacement mask frame for AirFit N20 (for Her) Nasal Mask. The fabric-lined frame is flexible enough to fit regardless of your face shape or size thanks to its unique design. ",90,Home > Sleep Apnea > CPAP Accessories > CPAP Mask Headgear > ResMed AirFit™ N20 for Her Mask Frame,https://shop.resmed.com.au/resmed-airfit-n20-for-her-mask-frame/,False,0,0
Sleep Apnea,,ResMed AirFit™ N20 for Her Mask Headgear,"Replacement headgear for Her N20 nasal mask. Available in Standard size.
",65,Home > Sleep Apnea > CPAP Accessories > CPAP Mask Headgear > ResMed AirFit™ N20 for Her Mask Headgear,https://shop.resmed.com.au/resmed-airfit-n20-mask-headgear-for-her/,False,4.8,6
Sleep Apnea,SKU:63473,ResMed AirFit™ F20 for Her Mask Headgear,"Replacement headgear for ResMed's AirFit F20 for Her full face mask.
The AirFit F20 for Her headgear features pink accents and plush straps designed to give you a more comfortable night's sleep.Available in Standard size only.",69,Home > Sleep Apnea > CPAP Accessories > CPAP Mask Headgear > ResMed AirFit™ F20 for Her Mask Headgear,https://shop.resmed.com.au/airfit-f20-for-her-headgear/,False,4.5,13
Sleep Health,SKU:CPAPILLOW,CPAP Pillow for Side Sleepers,"Comfortable pillow designed for CPAP users who sleep on their side and encourage easier breathing during Sleep Apnea therapy.
Comfortable pillow designed for CPAP users who sleep on their side and encourage easier breathing during Sleep Apnea therapy.",49.95,Home > Sleep Health > Pillows > CPAP Pillow for Side Sleepers,https://shop.resmed.com.au/cpap-pillow-for-side-sleepers/,True,4,64
Sleep Health,SKU:7078719,Sound Machine - Black,"Block background noise with these 20 soothing tones played through your LectroFan.
Playing white and pink noise can help improve sleep quality.LectroFan plays 20 soothing tones to help block background noise.Sounds that never loop The high definition sounds constantly evolve. They’re designed to help you fall asleep faster and stay asleep longer. The LectroFan offers twenty unique digital sounds to mask noises. You can choose from ten different electric fan sounds and ten variations of pure white noise. All sounds can be personalized with pin-point volume control to select across a wide range of sound levels, from a whisper, to many times louder than mechanical fan-based conditioners. Features include:• 20 Unique Digital Sounds (10 Fan Sounds + 10 White Noises)• Excellent Noise Masking (Up to 20dB louder than competing machines)• Precise Volume Control (1dB increment control for 10x quieter–10x louder than fan machines)• Small, sleek and stylish functional design• Upward facing speakers for full room sound• Built-in Timer Function for gentle turn off in 60, 120, 180 minutes or left on all nightCan be powered by USB port  ",89,Home > Sleep Health > Fall Asleep Faster > Sound Machine - Black,https://shop.resmed.com.au/sound-machine-black/,True,0,0
Sleep Apnea,,ResMed AirFit™ F20 Mask Headgear,"Replacement headgear for AirFit F20 Full Face Mask.
The replacement headgear for ResMed's AirFit F20 full face mask features blue accents and plush straps to give you a more comfortable night's sleep. Comes in 3 sizes (Small, Medium, Large).",69,Home > Sleep Apnea > CPAP Accessories > CPAP Mask Headgear > ResMed AirFit™ F20 Mask Headgear,https://shop.resmed.com.au/airfit-f20-mask-headgear/,False,4.3,61
Sleep Apnea,SKU:63475,ResMed AirFit™ F20/ F30/ F30i Mask Headgear Clips,"Replacement headgear clips for use with ResMed's AirFit F20 full face mask. Also fits ResMed's AirFit F30 and F30i masks.Pack of two.
These replacement headgear clips are magnetic and are designed to clip on and off with ease.Made for use with ResMed's AirFit F20 full face mask. Comes in a pack of two.",10,Home > Sleep Apnea > CPAP Accessories > CPAP Mask Parts > ResMed AirFit™ F20/ F30/ F30i Mask Headgear Clips,https://shop.resmed.com.au/airfit-f20-mask-headgear-clips/,False,3.6,10
Sleep Apnea,,ResMed AirFit™ F20 Mask Cushion,"Replacement cushion for the ResMed AirFit F20 or AirFit F20 for Her full face mask.
The AirFit F20 mask cushion features InfinitySeal™ technology to ensure that the mask moves comfortably with you throughout the night. ",75,Home > Sleep Apnea > CPAP Accessories > CPAP Mask Cushions > ResMed AirFit™ F20 Mask Cushion,https://shop.resmed.com.au/resmed-airfit-f20-mask-cushion/,False,4.2,72
Sleep Apnea,SKU:63476,ResMed AirFit™ F20 and AirFit™ F30 Mask Standard Elbow,"Replacement standard elbow for ResMed's AirFit F20 and AirFit F30 full face mask.
",50,Home > Sleep Apnea > CPAP Accessories > CPAP Mask Parts > ResMed AirFit™ F20 and AirFit™ F30 Mask Standard Elbow,https://shop.resmed.com.au/airfit-f20-mask-elbow/,False,5,2
Sleep Apnea,SKU:63465,ResMed AirFit™ F20 Mask Frame,"Replacement mask frame for the AirFit F20 full face mask.
The AirFit F20 mask frame is soft and flexible with padded straps for extra comfort. ",95,Home > Sleep Apnea > CPAP Accessories > CPAP Mask Headgear > ResMed AirFit™ F20 Mask Frame,https://shop.resmed.com.au/resmed-airfit-f20-mask-frame/,False,5,1
Sleep Apnea,SKU:63477,ResMed AirFit™ F20 Mask Soft Sleeves,"Soft sleeves to cover the AirFit F20 and AirFit F20 for Her mask frame.
Replacement soft sleeves for the AirFit F20 and AirFit F20 for Her full face masks. Designed to increase your comfort and reduce facial marks during your therapy.",15,Home > Sleep Apnea > CPAP Accessories > CPAP Mask Cushions > ResMed AirFit™ F20 Mask Soft Sleeves,https://shop.resmed.com.au/airfit-f20-mask-soft-sleeves/,False,4.3,3
Sleep Apnea,,ResMed AirFit™ N10 Mask Cushion,"This replacement cushion fits the ResMed AirFit N10 nasal mask. Choose from Small, Standard or Wide fit.
This replacement cushion fits the ResMed AirFit N10 nasal mask. The dual wall Spring Air cushion is designed to provide you with a comfortable seal as you move throughout the night. The lightweight, durable flexi-tube integrates directly into the frame allowing for 360° movement as you sleep without compromising the seal. Choose from three sizes: Small, Standard or Wide. ",89,Home > Sleep Apnea > CPAP Accessories > CPAP Mask Cushions > ResMed AirFit™ N10 Mask Cushion,https://shop.resmed.com.au/resmed-airfit-n10-cushion/,False,5,1
Sleep Apnea,SKU:63261,ResMed AirFit™ N10 for Her Mask Headgear,"Replacement headgear in pink for her. Suits AirFit N10
AirFit N10 SoftEdge headgear for her features slimmed-down straps to maximise comfort and minimise facial marks.",85,Home > Sleep Apnea > CPAP Accessories > CPAP Mask Headgear > ResMed AirFit™ N10 for Her Mask Headgear,https://shop.resmed.com.au/airfit-n10-for-her-headgear/,False,0,0
Sleep Health,,Sweet Dreams Light Bulb,"Create flicker free, high quality, warm evening lighting allowing your body to properly wind down and relax.
Standard household light bulbs that emit blue light can trick your brain into thinking it’s daytime.Replace them with Sweet Dreams Bulbs which delivers warm light to help facilitate sleep.Block blue light This allows your body to naturally wind down and produce melatonin (the sleep hormone) to prepare your body for a good night’s sleep.Comfortable, flicker-free, warm light These BlockBlueLight Sweet Dreams Bulbs utilises proprietary spectrum technology to deliver flicker free, high quality, warm evening lighting allowing you to properly wind down and relax. It may improve the quality and duration of sleep and supports the natural sleep cycle.Support your sleep-wake cycle Get your body clock in synch so you enjoy a restful night’s sleep and awake refreshed, ready to enjoy the day.For best results: Once the sun has set turn off any other artificial lighting and electronics and use the Sweet Dreams bulbs for optimal benefits.",29,Home > Sleep Health > Lighting > Sweet Dreams Light Bulb,https://shop.resmed.com.au/sweet-dreams-light-bulb/,True,0,0
Sleep Apnea,SKU:62935,ResMed AirFit™ P10 Mask Headgear,"Replacement blue “Standard” adjustable QuickFit™ headgear for the AirFit P10 nasal pillows mask.
The adjustable QuickFit™ elastic headgear is designed to make AirFit P10 easy to fit and adjust at home. The new single side-clip on the headgear provides added adjustability if needed.",60,Home > Sleep Apnea > CPAP Accessories > CPAP Mask Headgear > ResMed AirFit™ P10 Mask Headgear,https://shop.resmed.com.au/resmed-airfit-p10-mask-headgear/,False,3.8,32
Sleep Health,SKU:7078710,Dreampad™,"Lull yourself to sleep faster with music on a pillow that only you can hear. Custom-designed medium firmness pillows that connect to your phone and provide a unique sound experience that only you can hear.
Uses sound vibrations Only you can hear the music. Dreampad’s sound vibrations are detected by your inner ear to help usher in a deep and uninterrupted night’s sleep.7 songs engineered for deep sleep Your Dreampad app* includes 7 songs and soundscapes chosen for their ability to induce sleep. You can also play your own favourite tunes. Play for a few minutes or all night. Use the timer to play the music as long as you wish.Want to know more?",189,Home > Sleep Health > Pillows > Dreampad™,https://shop.resmed.com.au/dreampad-pillow/,True,2.3,3
Sleep Health,SKU:7078762,Contoured Eye Mask,"Block all light while you sleep with this comfortable contoured eye mask.
Block all light while you sleep with this comfortable eye mask.It's contoured so there’s no light leakage around your nose or pressure on your eyes.",20,Home > Sleep Health > Fall Asleep Faster > Contoured Eye Mask,https://shop.resmed.com.au/contoured-eye-mask/,True,2.7,3
Sleep Health,SKU:7078761,Red LED bulbs x2,"Replacement bulbs for your Red NightLight.
",20,Home > Sleep Health > Lighting > Red LED bulbs x2,https://shop.resmed.com.au/red-led-bulbs-x2/,True,0,0
Insomnia,SKU:7078771,ResMed Sleepy Time Tea,"Relax and unwind at the end of a busy day with this delicious blend of herbal tea.
",10.95,Home > Sleep Health > Pre-Bedtime Aids > ResMed Sleepy Time Tea,https://shop.resmed.com.au/resmed-sleepy-time-tea/,False,4.7,6
Insomnia,SKU:7078710,Dreampad™,"Lull yourself to sleep faster with music on a pillow that only you can hear. Custom-designed medium firmness pillows that connect to your phone and provide a unique sound experience that only you can hear.
Uses sound vibrations Only you can hear the music. Dreampad’s sound vibrations are detected by your inner ear to help usher in a deep and uninterrupted night’s sleep.7 songs engineered for deep sleep Your Dreampad app* includes 7 songs and soundscapes chosen for their ability to induce sleep. You can also play your own favourite tunes. Play for a few minutes or all night. Use the timer to play the music as long as you wish.Want to know more?",189,Home > Sleep Health > Pillows > Dreampad™,https://shop.resmed.com.au/dreampad-pillow/,True,2.3,3
Insomnia,SKU:7078767,Dodow,"Designed to help soothe your racing mind, slow your breathing and relax your body so you can fall asleep faster.
Pulses a soft light on the ceiling Match your breathing to Dodow’s soft blue light as it pulses on your ceiling. The light pulses gradually slow down to 6 cycles per minute creating the ideal rhythm to help you drift off to sleep.Slow breathing primes your body for sleepAt 6 breaths per minute your body’s baroreflex is stimulated. This lowers your blood pressure and heart rate, priming your body for sleep.Go to sleep, or get back to sleep Whether your problem is falling asleep or a waking up during the night, Dodow can help you enjoy more restful sleep. You can dim the light intensity to ensure your partner isn’t disturbed.",70,Home > Sleep Health > Fall Asleep Faster > Dodow,https://shop.resmed.com.au/my-dodow/,True,2.2,12
Sleep Health,,Blue Light Blocking Glasses Kids NightFall,"Advanced blue and green light blocking lenses designed for children for after-dark use. They block 99% of blue and green light.
Overexposure to high frequency blue and green light from digital devices and artificial lighting may damage the development of a child's eye sight.These glasses feature a Nocturnal Kids Lens - specially designed to be a lighter shade of red to allow more yellow, orange, and red light wavelengths through while still blocking blue and green wavelengths.",69,Home > Sleep Health > Glasses > Blue Light Blocking Glasses Kids NightFall,https://shop.resmed.com.au/blkblulht-glasses-kids-nightfall/,True,0,0
Insomnia,SKU:RETIMER,Re-timer Light Therapy Glasses,"Re-timer, a portable light therapy glasses for people on the go. These glasses use unique UV-free, sleep-inducing lights to get your sleeping pattern balanced. Simply put them on for 30 minutes a day while you get your day started or use them later while you relax after work.
University developed and backed by 25 years of research, Re-Timer uses light therapy, to re-program your body's sleep schedule. Re-Timer glasses should be worn for 30 minutes a day. Travellers who need to combat jet lag, shift workers and people who suffer from the winter blues due to reduced exposure to natural light",299,Home > Sleep Health > Glasses > Re-timer Light Therapy Glasses,https://shop.resmed.com.au/re-timer-light-therapy-glasses/,True,5,1
Sleep Apnea,,ResMed Micro and Quattro™ mask headgear without clips,"Small size Headgear for the ResMed Mirage Quattro Full Face or Micro Nasal mask.
This type of headgear allows you to easily and quickly remove it during your therapy. It also gives you the freedom to move during your sleep. Small size Headgear for the ResMed Mirage Quattro Full Face or Micro Nasal mask. ",65,Home > Sleep Apnea > CPAP Accessories > CPAP Mask Headgear > ResMed Micro and Quattro™ mask headgear without clips,https://shop.resmed.com.au/micro-and-quattro-headgear-without-clips/,False,0,0
Sleep Apnea,SKU:61295,ResMed Quattro™ Mask Ports Cap (2 Pack),"Replacement Ports Cap for ResMed Quattro Mirage Full Face Mask (Pack of 2).
",6.9,Home > Sleep Apnea > CPAP Accessories > CPAP Mask Parts > ResMed Quattro™ Mask Ports Cap (2 Pack),https://shop.resmed.com.au/resmed-quattro-ports-cap-2-pack/,False,0,0
Sleep Apnea,,ResMed AirFit™ N20 Classic Mask,"If you're after comfort and dependability, this may be the mask for you! Designed to seal robustly on a wide range of facial shapes or sizes, the InfinitySeal cushion aims to provide a secure fit and moves comfortably with you throughout the night. Available in small, medium and large sizes.
Finding the right mask can be an exhausting experience. We’re here to help ease the process for you. The InfinitySeal™ silicone cushion on the AirFit N20 Classic is designed to adapt to your unique facial contours, giving you one less thing to worry about!ALWAYS READ THE LABEL AND FOLLOW THE INSTRUCTIONS FOR USE. IF SYMPTOMS PERSIST, TALK TO YOUR HEALTHCARE PROFESSIONAL.",195,Home > Sleep Apnea > CPAP Masks > Nasal Masks > ResMed AirFit™ N20 Classic Mask,https://shop.resmed.com.au/resmed-airfit-n20-classic/,True,4,3
Sleep Apnea,SKU:36800,ResMed H5i™ Humidifier Chamber,"Easy to disassemble, clean and reassemble. Even throw it in the dishwasher.
The H5i water tub is a durable water chamber for your H5i humidifier.It's easy to disassemble, clean and reassemble.It can even be washed in the dishwasher. Now that will save you the hassle of having to wash it separately.",105,Home > Sleep Apnea > CPAP Accessories > Humidifiers > ResMed H5i™ Humidifier Chamber,https://shop.resmed.com.au/resmed-h5i-humidifier-chamber/,False,3,2
Sleep Apnea,SKU:62936,ResMed AirFit™ P10 for Her Mask Headgear,"Replacement pink “for Her” adjustable QuickFit™ headgear for the AirFit P10 or AirFit P10 for Her nasal pillows mask.
The adjustable QuickFit™ elastic headgear is designed to make AirFit P10 for Her easy to fit and adjust at home. The new single side-clip on the headgear provides added adjustability if needed. ",60,Home > Sleep Apnea > CPAP Accessories > CPAP Mask Headgear > ResMed AirFit™ P10 for Her Mask Headgear,https://shop.resmed.com.au/resmed-airfit-p10-mask-headgear-for-her/,False,4.1,11
Sleep Apnea,SKU:62110,ResMed Mirage FX™ Mask Headgear,"Replacement headgear for Mirage FX
Mirage FX features a form-fitting SoftEgde headgear which is flexible and light, with a contoured edge that's kind to your face. ",85,Home > Sleep Apnea > CPAP Accessories > CPAP Mask Headgear > ResMed Mirage FX™ Mask Headgear,https://shop.resmed.com.au/mirage-fx-headgear/,False,4,2
