category,sku,product,description,price,breadcrumb,product_url,money_back,rating,total_reviews
Bestsellers,SKU:38813,ResMed HumidX™ Plus (6 Pack),"6 pack of HumidX Plus capsules for use with AirMini™ compatible AirFit™ nasal and nasal pillows mask systems. Each one provides waterless humidification when used with a ResMed AirMini CPAP machine.
HumidX are small heat and moisture exchangers (HME) designed to provide you with a comfortable experience at home or on holiday.HumidX Plus can be used in dry and high altitude environments where humidity is low. For instance, if you are traveling by plane, this would be the perfect solution.When you exhale, heat and moisture is stored within the HME's tiny paper ridges. When you inhale, this heat and moisture is released to humidify the air you breathe in.Each pack contains 6 capsules for use.ALWAYS READ THE LABEL AND FOLLOW THE INSTRUCTIONS FOR USE. IF SYMPTOMS PERSIST, TALK TO YOUR HEALTHCARE PROFESSIONAL.",59,Home > Bestsellers > ResMed HumidX™ Plus (6 Pack),https://shop.resmed.com.au/resmed-humidx-plus-6-pack/,False,4,20
Bestsellers,,ResMed AirFit™ N30i Nasal Cradle Mask,"The Airfit N30i CPAP mask is a nasal cradle mask designed to keep tubing out of the way and free the way to sleep any way you want. With a self-adjusting Springfit frame and 3 different cushion sizes you can choose the right fit for you and move freely during the night with better comfort.
Key Features Size GuideAirFit N30i GuidesAirFit N30i masks can easily be used with most CPAP devices (except the ResMed AirMini due to its specialised ventilation system).ALWAYS READ THE LABEL AND FOLLOW THE INSTRUCTIONS FOR USE. IF SYMPTOMS PERSIST, TALK TO YOUR HEALTHCARE PROFESSIONAL.",229,Home > Sleep Apnea > CPAP Masks > Nasal Cradle Masks > ResMed AirFit™ N30i Nasal Cradle Mask,https://shop.resmed.com.au/resmed-airfit-n30i-nasal-cradle-mask/,True,4,23
Bestsellers,,ResMed AirFit™ P10 Pillows Mask,"The AirFit P10 nasal pillows mask comes complete with frame, a selection of nasal pillows, and an adjustable QuickFit™ elastic headgear. Select blue ""Standard"" (incl. S, M, and L nasal pillows) or pink ""for Her"" (incl. XS, S, and M nasal pillows).
Key FeaturesSize OptionsAirFit P10 GuidesALWAYS READ THE LABEL AND FOLLOW THE INSTRUCTIONS FOR USE. IF SYMPTOMS PERSIST, TALK TO YOUR HEALTHCARE PROFESSIONAL.",209,Home > Sleep Apnea > CPAP Masks > Nasal Pillow Masks > ResMed AirFit™ P10 Pillows Mask,https://shop.resmed.com.au/resmed-airfit-p10-pillows-mask/,True,4.3,36
Bestsellers,,ResMed AirTouch™ F20 Cushion (3 Pack),"Pack of 3 x soft, breathable, UltraSoft memory foam cushions for ResMed's AirTouch F20 or AirFit™ F20 full face mask.
The UltraSoft memory foam cushion for the AirTouch F20 full-face mask brings comfort to your CPAP therapy. This replaceable cushion adapts to your facial profile to deliver outstanding fit and seal, but remains breathable. The memory foam minimises contact pressure on your skin, reducing the likelihood of red facial marks on your skin.To ensure optimum comfort, it's recommended to replace the AirTouch UltraSoft memory foam cushion every 4 weeks.This pack includes 3 x UltraSoft memory foam cushions. These cushions can also be used with the AirFit F20 full face mask frame.",69,Home > Sleep Apnea > CPAP Accessories > CPAP Mask Cushions > ResMed AirTouch™ F20 Cushion (3 Pack),https://shop.resmed.com.au/resmed-airtouch-f20-cushion-3pk/,False,4.4,195
Bestsellers,,ResMed AirFit™ N20 Nasal Mask,"Designed to fit any face shape or size, the AirFit N20 moves comfortably with you through the night, providing a secure fit and comfortable seal tailored to your therapy needs.
Key FeaturesSize OptionsAirFit N20 GuidesALWAYS READ THE LABEL AND FOLLOW THE INSTRUCTIONS FOR USE. IF SYMPTOMS PERSIST, TALK TO YOUR HEALTHCARE PROFESSIONAL.",209,Home > Sleep Apnea > CPAP Masks > Nasal Masks > ResMed AirFit™ N20 Nasal Mask,https://shop.resmed.com.au/resmed-airfit-n20-nasal-mask/,True,4.1,33
Bestsellers,,ResMed AirFit™ P30i Pillows Mask,"The Airfit P30i CPAP mask is a nasal cradle mask designed to keep tubing out of the way and give back the freedom to sleep any way you want. With a soft-fitting frame that is designed to keep you supported all night,  and our QuietAir™ vent designed to minimise noise this mask is an ideal fit for quiet nights with our partners.
Key FeaturesSize OptionsAirFit P30i GuidesAirFit P30i masks can easily be used with most CPAP devices (except the ResMed AirMini due to its specialised ventilation system).ALWAYS READ THE LABEL AND FOLLOW THE INSTRUCTIONS FOR USE. IF SYMPTOMS PERSIST, TALK TO YOUR HEALTHCARE PROFESSIONAL. ",229,Home > Sleep Apnea > CPAP Masks > Nasal Pillow Masks > ResMed AirFit™ P30i Pillows Mask,https://shop.resmed.com.au/resmed-airfit-p30i-pillows-mask/,True,3.7,23
Bestsellers,,ResMed AirFit™ F30i Full Face Mask,"AirFit F30i is a minimal-contact full face mask, designed for all sleeping positions. Designed with two magnetic clips to slip your mask on and off with ease. The under-the-nose cushion gives you the freedom to relax and watch a show before bed, by giving you a wider frame of vision. While the mouth cover delivers consistent humidity and comfort for mouth breathers.
ResMed AirFit F30i full face mask features a comfortable UltraCompact cushion and top-of-head tube connection, so you have the freedom to sleep in many positions. Thanks to the under-the-nose cushion, red marks and discomfort on your nasal bridge are a thing of the past.Key FeaturesSize OptionsAirFit F30i GuidesALWAYS READ THE LABEL AND FOLLOW THE INSTRUCTIONS FOR USE. IF SYMPTOMS PERSIST, TALK TO YOUR HEALTHCARE PROFESSIONAL. ",249,Home > Sleep Apnea > CPAP Masks > Full Face Masks > ResMed AirFit™ F30i Full Face Mask,https://shop.resmed.com.au/resmed-airfit-f30i-full-face-mask/,True,3.7,27
Bestsellers,SKU:38140,ResMed AirMini™ Automatic CPAP Machine,"ResMed Airmini is a portable travel CPAP device that can be used as an everyday CPAP machine. Ensure that you have the appropriate,
Please ensure that you have a compatible AirFit™ & AirTouch™ Mask listed below together with a setup pack to use with the AirMini.Compatible AirFit™ / AirTouch™ MaskRequired Setup Pack Enjoy the warmth and comfort of humidification without the hassle. ResMed's HumidX™ system delivers a similar level of humidification to our market-leading bedside devices*** with the added convenience of being a compact waterless system.** AirMini AppDownload the AirMini app on the  or .Features / CPAP MachineAirSense 10 Elite FixedPressure CPAP MachineAirSense 10 Autoset Auto MachineAirSense 10 Autoset for HerAuto MachineAirMini Automatic CPAP MachineCPAP✓✓✓✓AutoSet ✓✓✓AutoSet for Her  ✓✓Cheyne-Stokes respiration detection✓✓✓✓Central apnea detection✓✓✓✓RERA reporting  ✓✓AutoSet algorithm with AutoSet Response ✓✓✓AutoRamp with sleep onset detection✓✓✓✓Advanced HumidAir technology✓✓✓ Enhanced Climate Control Auto✓✓✓ Waterless Humidification   ✓Expiratory Pressure Relief (EPR™)✓✓✓✓SmartStart™✓✓✓✓Aircraft use*✓✓✓✓Pressure: 4 to 20 cm H2O✓✓✓✓Sound pressure level26.6 dBA26.6 dBA26.6 dBA30dB withuncertainty of 2 dBAWeight1248g1248g1248g300gDimensions(Height x Depth x Width)116mm x 150mm x 255mm116mm x 150mm x 255mm116mm x 150mm x 255mm52mm x 84mm x 136mmMask Compatilibity**All MasksAll MasksAll MasksSelected ResMed MasksData Connectivity***Card to Cloud4G***4G***Bluetooth*ALWAYS READ THE LABEL AND FOLLOW THE INSTRUCTIONS FOR USE. IF SYMPTOMS PERSIST, TALK TO YOUR HEALTHCARE PROFESSIONAL.",1565,Home > Sleep Apnea > CPAP Machines > Travel Sized Machines > ResMed AirMini™ Automatic CPAP Machine,https://shop.resmed.com.au/ResMed-AirMini-Smallest-CPAP-AutoSet-Device/,True,4.8,4
Bestsellers,SKU:7078706,SnoreRx ®,"The SnoreRx mouthpiece is a simple, cost-effective treatment designed to reduce snoring. You can customise it yourself so it fits your mouth comfortably.
Safe to use All components are made from premium copolymer materials. There are no latex, screws, wires, nuts, bolts or springs.Customised fit You customise SnoreRx using the ‘boil and bite’ process to make an accurate impression of your mouth.Adjustable SnoreRx is the only anti-snoring mouthpiece that offers precise calibration in 1mm increments. No tools are required to set or reset. SnoreRx is a semi-custom mandibular advancement device (MAD) that gently advances the lower jaw forward. It opens your airway at night, improves breathing and reduces the irritating snoring sound. Unlike other snoring mouthguards, SnoreRx can be calibrated to a custom setting at any time in 1 millimeter increments to provide optimal comfort and effectiveness.SnoreRx is comprised of two medical-grade copolymers. All components are latex-free and hypoallergenic.SnoreRx uses the boil-and-bite process to create a custom impression of your teeth. If your current impression does not clearly display well-defined teeth marks, you may repeat the custom fitting steps. The custom fitting steps can be done a total of two times.SnoreRx's patented design accomodates adjustment of the lower jaw in one millimeter increments. The lower jaw can be adjusted up to six millimeters.We recommend to use SnoreRx on the 1 millimeter setting the first night of use. If snoring is not reduced after 3 to 5 nights, the setting can be advanced one additional millimeter. Each setting should be worn a minimum of 3 to 5 nights prior to adjusting. Most users find that snoring is significantly reduced on a setting of 3 to 5 millimeters. SnoreRx should not be used by individuals who:ALWAYS READ THE LABEL AND FOLLOW THE INSTRUCTIONS FOR USE. IF SYMPTOMS PERSIST, TALK TO YOUR HEALTHCARE PROFESSIONAL.",99,Home > Sleep Apnea > CPAP Alternatives > SnoreRx ®,https://shop.resmed.com.au/snore-rx/,True,2.8,85
Bestsellers,SKU:37299,ResMed HumidAir™ Standard Tub for Air10™ & Lumis™,"Providing you with relief from dryness and congestion. Once you have filled it with water and connected it, you’re ready to go.
Designed to seamlessly integrate with your AirSense™ 10, AirCurve™ 10 or Lumis™ device and provide you with relief from dryness and congestion.Once you have filled the HumidAir tub with water and connected it, you’re ready to go. The humidity levels can be adjusted accordingly to your level of comfort.When used with the ClimateLineAir™ heated tube, it warms the air at a consistent, comfortable temperature that minimises condensation and rainout.We recommend replacing your Standard HumidAir tub every 6 months.ALWAYS READ THE LABEL AND FOLLOW THE INSTRUCTIONS FOR USE. IF SYMPTOMS PERSIST, TALK TO YOUR HEALTHCARE PROFESSIONAL.",85,Home > Bestsellers > ResMed HumidAir™ Standard Tub for Air10™ & Lumis™,https://shop.resmed.com.au/resmed-humidair-standard-tub-for-air10-lumis/,False,4.3,16
Bestsellers,SKU:38815,ResMed AirMini™ Filters (2 Pack),"Block fine dust from entering your AirMini device with these disposable filters. Pack of two.
Keep your AirMini device clean by using these filters to block fine materials and larger particles from entering your machine.Sold as a pack of 2 filters. These standard air filters are only suitable for use with the ResMed AirMini device.These filters are disposable and aren't suitable for washing.",5.9,Home > Bestsellers > ResMed AirMini™ Filters (2 Pack),https://shop.resmed.com.au/resmed-airmini-filters-2-pack/,False,4.6,5
Bestsellers,SKU:BND275,AirMini Total Care Subscription,"Trial a ResMed Automatic CPAP via our online shop. Order your CPAP in minutes and we will deliver straight to your preferred location, for free. Our support team is available via live chat or phone if you need any help ordering.
",0,Home > Bestsellers > AirMini Total Care Subscription,https://shop.resmed.com.au/airmini-total-care-subscription/,False,0,0
Bestsellers,SKU:BND273,AirSense™ 10 Total Care Subscription,"
",0,Home > Bestsellers > AirSense™ 10 Total Care Subscription,https://shop.resmed.com.au/airsense-10-total-care-subscription/,False,0,0
Bestsellers,,ResMed AirFit™ F20 Full Face Mask,"Designed to comfortably fit various face shapes, the AirFit F20 full face mask aims for a secure fit and comfortable seal while accommodating movement.
Key FeaturesSize OptionsAirFit F20 GuidesALWAYS READ THE LABEL AND FOLLOW THE INSTRUCTIONS FOR USE. IF SYMPTOMS PERSIST, TALK TO YOUR HEALTHCARE PROFESSIONAL.",229,Home > Sleep Apnea > CPAP Masks > Full Face Masks > ResMed AirFit™ F20 Full Face Mask,https://shop.resmed.com.au/resmed-airfit-f20-full-face-mask/,True,4.1,52
Bestsellers,SKU:7078979,onesleeptest,"The ResMed onesleeptest is a home sleep test.^ It consists of a small disposable NightOwl® sensor that you tape to your fingertip and a NightOwl® companion app that guides you through every step of the test.
onesleeptest includes:How does onesleeptest work, and what do I need to complete the test?Note: By purchasing this home sleep test, you agree to ResMed’s  and .ALWAYS READ THE LABEL AND FOLLOW THE INSTRUCTIONS FOR USE. IF SYMPTOMS PERSIST, TALK TO YOUR HEALTHCARE PROFESSIONAL^The onesleeptest is referred to as a level 4 sleep test. Level 4 sleep tests measure less parameters about your sleep compared with level 1, 2 and 3 sleep tests. We recommend you consult with your GP to discuss whether the onesleeptest is right for you.*ResMed Sleep Coaches are sales and customer service representatives who have received training in Sleep Health. They can give general information about Sleep Health, sleep disorders and products that may help improve your sleep. They are not qualified healthcare professionals and cannot provide medical advice. We recommend you continue to consult your GP.",149,Home > Sleep tests and trackers > Sleep Tests > onesleeptest,https://shop.resmed.com.au/one-sleep-test/,False,4.1,51
Bestsellers,SKU:BND277,Smart Care - AirTouch Mask Subscription,"Trial a ResMed Automatic CPAP via our online shop. Order your CPAP in minutes and we will deliver straight to your preferred location, for free. Our support team is available via live chat or phone if you need any help ordering.
Subscribe to our CPAP Mask Subscription below and receive a bonus cleaning kit*.Use code ""SMARTCARE"" at cart. Ends Wed, 15th Mar 2023. .",0,Home > Sleep Apnea > CPAP Masks > CPAP Mask Subscription > Smart Care - AirTouch Mask Subscription,https://shop.resmed.com.au/smart-care-airtouch/,False,0,0
Bestsellers,SKU:37457,ResMed AirSense™ 10 Autoset™ Automatic CPAP Machine,"ResMed Airsense 10 Automatic CPAP Machine automatically detects your sleep habits and changes your air pressure based on your needs.  Delivering consistent humidity for comfort throughout the night. Our 4G feature allows wireless connectivity with CPAP therapy health providers data about your sleep progress.
Detects sleep onsetAutoRamp™ with sleep onset detection starts by delivering low pressure for greater comfort. Then, after detecting that you’ve fallen asleep, it gradually increases the pressure to the prescribed level.Intuitive interfaceA simple interface enables you to just press start and go. It also provides feedback on your therapy every morning and makes it easy for you to change comfort settings.Consistent humidificationThe HumidAir™ humidifier and a ClimateLineAir™ heated air tube are designed to automatically deliver optimal temperature and humidity, for a more comfortable experience.ContraindicationsIf you suffer from any of the following pre-existing conditions please consult your doctor before using this device:It's recommended to read the  before using this device.For information about card-to-cloud devices, .ModesPressureSound pressure levelAircraft useHeight WidthDepthWeight Features / CPAP MachineAirSense 10 Elite FixedPressure CPAP MachineAirSense 10 Autoset Auto MachineAirSense 10 Autoset for HerAuto MachineAirMini Automatic CPAP MachineCPAP✓✓✓✓AutoSet ✓✓✓AutoSet for Her  ✓✓Cheyne-Stokes respiration detection✓✓✓✓Central apnea detection✓✓✓✓RERA reporting  ✓✓AutoSet algorithm with AutoSet Response ✓✓✓AutoRamp with sleep onset detection✓✓✓✓Advanced HumidAir technology✓✓✓ Enhanced Climate Control Auto✓✓✓ Waterless Humidification   ✓Expiratory Pressure Relief (EPR™)✓✓✓✓SmartStart™✓✓✓✓Aircraft use*✓✓✓✓Pressure: 4 to 20 cm H2O✓✓✓✓Sound pressure level26.6 dBA26.6 dBA26.6 dBA30dB withuncertainty of 2 dBAWeight1248g1248g1248g300gDimensions(Height x Depth x Width)116mm x 150mm x 255mm116mm x 150mm x 255mm116mm x 150mm x 255mm52mm x 84mm x 136mmMask Compatilibity**All MasksAll MasksAll MasksSelected ResMed MasksData Connectivity***Card to Cloud4G***4G***Bluetooth*What is the difference between AirSense 10 AutoSet 4G and AirSense 10 AutoSet card-to-cloud?   What is the benefit of a 4G cellular device?   What is myAir?  What is the difference between an AS10 AutoSet 4G and AS10 AutoSet for Her?  How can I tell if my device is a C2C or 4G device?  Can I just buy the 4G chip to enable wireless connectivity to my C2C device?  ",1815,Home > Sleep Apnea > CPAP Machines > Automatic Machines > ResMed AirSense™ 10 Autoset™ Automatic CPAP Machine,https://shop.resmed.com.au/resmed-airsense-10-autoset-auto-machine/,True,4.8,19
Bestsellers,SKU:BND276,Smart Care - AirFit Mask Subscription,"Trial a ResMed Automatic CPAP via our online shop. Order your CPAP in minutes and we will deliver straight to your preferred location, for free. Our support team is available via live chat or phone if you need any help ordering.
Subscribe to our CPAP Mask Subscription below and receive a bonus cleaning kit*.Use code ""SMARTCARE"" at cart. Ends Wed, 15th Mar 2023. .",0,Home > Sleep Apnea > CPAP Masks > CPAP Mask Subscription > Smart Care - AirFit Mask Subscription,https://shop.resmed.com.au/smart-care-airfit/,False,0,0
Sleep Health,,BLKBLULHT ScreenTime Computer Glasses,"Designed for those sitting in front of a computer during the day, filters 50% of blue light.
These daytime use glasses are designed for people who spend a lot of time during the day in front of screens. They feature a ClearBlue lens, to filter out artificial blue light emitted by digital devices, and other artificial light sources.These glasses filter over 50% of blue light across all of the blue light spectrum (400nm-500nm) to help alleviate digital eye strain, and sore and tired eyes from both screen time and bright LED or fluorescent lighting in the work place.",129,Home > Sleep Health > Glasses > BLKBLULHT ScreenTime Computer Glasses,https://shop.resmed.com.au/blkblulht-screentime-computer-glasses/,True,0,0
Sleep Health,,Swannies Night Glasses - Tortoise Shell,"Unisex glasses with tortoise shell frames that block blue-light at night time to help improve your sleep.
Blue light exposure at night from screens can increase your alertness at bedtime.Wear Swannies for 1-3 hours before bed and you can look forward to falling asleep faster as well as sleeping better and for longer.The frames are made from cellulose acetate, BPA-free material making them strong and light-weight.Spring hinges offer a wide range of movement for extra comfort and durability.The prescription grade lenses and anti-reflective coatings offer superior visual clarity and protection against blue light.Choose from Tortoise Shell in Small, Medium or Large sizes.",79,Home > Sleep Health > Glasses > Swannies Night Glasses - Tortoise Shell,https://shop.resmed.com.au/swannies-night-glasses-tortoise-shell/,True,0,0
Sleep Health,,Swannies Night Glasses - Classic Black,"Classic black unisex glasses to block blue-light at night time to help improve your sleep.
Blue light exposure at night from screens can increase your alertness at bedtime.Wear Swannies for 1-3 hours before bed and you can look forward to falling asleep faster as well as sleeping better and for longer.The frames are made from cellulose acetate, BPA-free material making them strong and light-weight.Spring hinges offer a wide range of movement for extra comfort and durability.The prescription grade lenses and anti-reflective coatings offer superior visual clarity and protection against blue light.Choose from Small, Medium or Large sizes.",79,Home > Sleep Health > Glasses > Swannies Night Glasses - Classic Black,https://shop.resmed.com.au/swannies-night-glasses/,True,5,1
Sleep Apnea,SKU:38816,ResMed AirMini™ Filters (12 Pack),"Keep fine dust and other particles out of your AirMini device with this 12 pack of disposable filters.
Keep your AirMini device clean by using these filters to block fine materials and larger particles from entering your machine.Sold as a pack of 12 filters. These standard air filters are only suitable for use with the ResMed AirMini device.One side of the filter blocks fine particles such as dust and the other blocks larger matter, like hair.These filters are disposable and aren't suitable for washing.",29.9,Home > Sleep Apnea > CPAP Accessories > CPAP Filters > ResMed AirMini™ Filters (12 Pack),https://shop.resmed.com.au/resmed-airmini-filters-12-pack/,False,4.9,11
Sleep Apnea,SKU:19729,ResMed AirSense™ 10 Filter Cover,"Replacement filter cover for the ResMed AirSense 10 CPAP machine.
This filter cover is only compatible for the ResMed AirSense 10 series of machines.",9.95,Home > Sleep Apnea > CPAP Accessories > CPAP Machine Parts > ResMed AirSense™ 10 Filter Cover,https://shop.resmed.com.au/resmed-airsense-10-filter-cover/,False,4.8,5
Sleep Apnea,SKU:38840,ResMed AirMini™ Premium Carry Bag,"This stylish premium carry bag for your ResMed AirMini is spacious enough to fit your AirMini machine, your choice of compatible mask, the tubing and much more!
This stylish carry bag makes travelling with your ResMed AirMini a breeze. The premium carry bag is spacious enough to fit your AirMini machine, your choice of an AirMini compatible mask, the tubing and much more! You can even squeeze in your mobile device too. The carry bag will hold all the components you need to make your AirMini solution work, to achieve the best therapy for you. All you need is your machine, mask and tubing, and you're on your way to getting the rest you deserve.",90,Home > Sleep Apnea > CPAP Accessories > CPAP Bags > ResMed AirMini™ Premium Carry Bag,https://shop.resmed.com.au/resmed-airmini-premium-carry-bag/,False,4.8,5
Sleep Apnea,SKU:38841,ResMed AirMini™ Hard Case,"Protect your ResMed AirMini device when you travel with this rigid carry case.
Protect your ResMed AirMini device with this rigid grey carry case. It even fits into the Premium carry bag!It's convenient and useful when travelling as it is just the right fit for any suitcase.Only available for the AirMini device.",50,Home > Sleep Apnea > CPAP Accessories > CPAP Bags > ResMed AirMini™ Hard Case,https://shop.resmed.com.au/resmed-airmini-hard-case/,False,2,1
Sleep Apnea,SKU:19768,ResMed AirSense™ 10 for Her Filter Cover,"Replacement filter cover for ResMed AirSense 10 for Her CPAP machine.
ResMed For Her Filter Cover. Compatible with the ResMed AirSense 10 for Her CPAP machine.",9.95,Home > Sleep Apnea > CPAP Accessories > CPAP Machine Parts > ResMed AirSense™ 10 for Her Filter Cover,https://shop.resmed.com.au/resmed-airsense-10-for-her-filter-cover/,False,5,1
Sleep Apnea,SKU:37378,"ResMed AirSense™ 10, AirCurve™ 10 and Lumis™ SD Card","Recommended SD card for use with your AirSense 10 CPAP machine.
The ResMed SD cards easily stores 365 days of usage data, 30 days of detailed data, and seven days of high-resolution data.ResMed supply SD cards for your devices that meet required safety standards.These SD cards are supplied with your therapy machine or can be purchased here separately.",19.95,"Home > Sleep Apnea > CPAP Accessories > Data Management > ResMed AirSense™ 10, AirCurve™ 10 and Lumis™ SD Card",https://shop.resmed.com.au/resmed-airsense-10-sd-card/,False,4,2
Sleep Apnea,SKU:37335,ResMed AirSense™ 10 for Her Side Cover - Grey,"This grey side cover for the ResMed AirSense for Her 10 can be used in place of the humidifier when you're travelling.
If you are traveling and would like to use your AirSense 10 for Her machine without the humidifier, this is the perfect accessory to use! The AirSense 10 for Her side cover can be used in place of the humidifier so you can continue your therapy hassle-free.",29.95,Home > Sleep Apnea > CPAP Accessories > CPAP Machine Parts > ResMed AirSense™ 10 for Her Side Cover - Grey,https://shop.resmed.com.au/resmed-airsense-10-for-her-side-cover-grey/,False,5,1
Sleep Apnea,SKU:37303,ResMed AirSense™ 10 Side Cover - Charcoal,"This charcoal coloured side cover for the AirSense 10 can be used in place of the humidifier when you're travelling.
If you are traveling and would like to use your AirSense 10 machine without the humidifier, this is the perfect accessory to use! The charcoal coloured side cover can be used in place of the humidifier so you can continue your therapy hassle-free.",29.95,Home > Sleep Apnea > CPAP Accessories > CPAP Machine Parts > ResMed AirSense™ 10 Side Cover - Charcoal,https://shop.resmed.com.au/resmed-airsense-10-side-cover-charcoal/,False,4.8,16
Sleep Apnea,SKU:38845,ResMed P10 Connector for AirMini™,"The AirMini P10 connector enables you to connect your ResMed AirFit™ P10 or AirFit P10 for Her mask to the ResMed AirMini CPAP machine. It includes the AirMini compatible AirFit P10 frame and vent only. AirMini tubing is not included.
",80,Home > Sleep Apnea > CPAP Accessories > CPAP Mask Parts > ResMed P10 Connector for AirMini™,https://shop.resmed.com.au/resmed-p10-connector-for-airmini/,False,4.8,5
Sleep Apnea,SKU:7078905,ResMed Pure Liquid Soap,"
",7.7,Home > Sleep Apnea > CPAP Accessories > CPAP Cleaning > ResMed Pure Liquid Soap,https://shop.resmed.com.au/resmed-pure-liquid-soap/,False,4.9,9
