category,sku,product,description,price,breadcrumb,product_url,money_back,rating,total_reviews
Sleep Apnea,SKU:37304,ResMed AirSense™ 10 Travel Bag,"Take your therapy with you using the portable and classy AirSense 10 Travel Bag.
Take your therapy with you using the portable and classy AirSense 10 Travel Bag.Designed to fit your machine, humidifier, tubes, mask of choice, power supply and cleaning accessories.Now you can take your machine where-ever you go and not have to worry about missing out on your nightly therapy!",49.95,Home > Sleep Apnea > CPAP Accessories > CPAP Bags > ResMed AirSense™ 10 Travel Bag,https://shop.resmed.com.au/resmed-airsense-10-travel-bag/,False,5,3
Sleep Apnea,SKU:24964,ResMed Power Station II Battery Coupler Kit,"Double your CPAP machine's run time with this battery coupler kit.
This battery coupler kit helps you to connect two ResMed Power Station II batteries together so they can be used simultaneously to power your ResMed CPAP machine to double the run time.ALWAYS READ THE LABEL AND FOLLOW THE INSTRUCTIONS FOR USE. IF SYMPTOMS PERSIST, TALK TO YOUR HEALTHCARE PROFESSIONAL. ",120,Home > Sleep Apnea > CPAP Accessories > Batteries and Power > ResMed Power Station II Battery Coupler Kit,https://shop.resmed.com.au/resmed-battery-connector-for-powerstation-ii/,False,0,0
Sleep Apnea,,ResMed AirTouch™ N20 Starter Pack,"This starter pack contains 1 x AirTouch N20 nasal mask system and 2 x UltraSoft™ memory foam cushions (3 months' supply).
Description:ResMed's AirTouch N20, with its UltraSoft memory foam cushion, is our softest nasal mask ever. It's designed to offer unprecedented mask comfort and ease-of-use.Key featuresSize optionsAirTouch N20 GuidesALWAYS READ THE LABEL AND FOLLOW THE INSTRUCTIONS FOR USE. IF SYMPTOMS PERSIST, TALK TO YOUR HEALTHCARE PROFESSIONAL.",199,Home > Sleep Apnea > CPAP Masks > Nasal Masks > ResMed AirTouch™ N20 Starter Pack,https://shop.resmed.com.au/resmed-airtouch-n20-starter-pack/,False,4.4,9
Sleep Apnea,,ResMed AirTouch™ N20 Cushion (3 Pack),"Pack of 3 x UltraSoft™ memory foam cushions for ResMed's AirTouch N20 or AirFit™ N20 nasal masks.
Description:AirTouch N20 nasal mask is designed to adapt to the unique contours of your face for an individualised and comfortable fit. Its memory foam also minimises contact pressure on your skin to help reduce the likelihood of skin irritation, soreness and red marks around the nasal bridge.The disposable AirTouch UltraSoft memory foam cushion should be replaced monthly to maintain optimum comfort.This pack includes 3 x UltraSoft memory foam cushions and can be used with the AirFit N20 nasal mask frame.Size optionsAirTouch N20 Guides",69,Home > Sleep Apnea > CPAP Accessories > CPAP Mask Cushions > ResMed AirTouch™ N20 Cushion (3 Pack),https://shop.resmed.com.au/resmed-airtouch-n20-cushion-3-pack/,False,4.4,41
Sleep Apnea,,ResMed AirTouch™ N20 Mask Cushion (Single),"Replacement UltraSoft™ memory foam cushion for ResMed's AirTouch N20 nasal mask. This soft, breathable memory foam cushion is also compatible with the AirFit™ N20 nasal mask frame. Single cushion only.
Description: AirTouch N20 nasal mask brings a new level of comfort to Sleep Apnea therapy. Its replaceable cushion is designed to adapt to the unique contours of your face for an individualised and comfortable fit that’s also secure. Its memory foam also minimises contact pressure on your skin to help reduce the likelihood of skin irritation, soreness and red marks around the nasal bridge. For easy maintenance and optimum comfort, the AirTouch UltraSoft memory foam cushion is designed to be replaced monthly.Try out the UltraSoft memory foam cushion and experience the difference.Size options:AirTouch N20 Guides",29,Home > Sleep Apnea > CPAP Accessories > CPAP Mask Cushions > ResMed AirTouch™ N20 Mask Cushion (Single),https://shop.resmed.com.au/resmed-airtouch-n20-mask-cushion-single/,False,4.1,7
Sleep Apnea,SKU:38010,AirMini™ F30 Setup Pack (No Mask),"This setup pack enables you to connect your ResMed AirFit™ F30 mask to the ResMed AirMini CPAP machine. It includes an AirMini F20/F30 connector and flexible AirMini tubing.
ALWAYS READ THE LABEL AND FOLLOW THE INSTRUCTIONS FOR USE. IF SYMPTOMS PERSIST, TALK TO YOUR HEALTHCARE PROFESSIONAL.",60,Home > Sleep Apnea > CPAP Accessories > CPAP Mask Parts > AirMini™ F30 Setup Pack (No Mask),https://shop.resmed.com.au/airmini-f30-setup-pack-no-mask/,False,4,1
Sleep Apnea,SKU:38011,AirMini™ F20 Setup Pack (No Mask),"This setup pack enables you to connect your ResMed AirFit™ F20 or AirTouch™ F20 mask to the ResMed AirMini CPAP machine. It includes an AirMini F20/F30 Connector, HumidX™ F20 and flexible AirMini tubing.
ALWAYS READ THE LABEL AND FOLLOW THE INSTRUCTIONS FOR USE. IF SYMPTOMS PERSIST, TALK TO YOUR HEALTHCARE PROFESSIONAL.",67.5,Home > Sleep Apnea > CPAP Accessories > CPAP Mask Parts > AirMini™ F20 Setup Pack (No Mask),https://shop.resmed.com.au/airmini-f20-setup-pack-no-mask/,False,4.8,4
Sleep Apnea,SKU:38012,HumidX™ F20 (3 Pack),"3 pack of HumidX capsules for AirFit™ F20 or AirTouch™ F20 full face masks. Each one provides waterless humidification when used with a ResMed AirMini™ CPAP machine.
Description:HumidX heat moisture exchangers (HME) are designed to provide you with waterless humidification when you're using therapy.They work by capturing heat and moisture within tiny paper ridges when you exhale. They then release this heat and moisture to humidify the air when you inhale.Each pack contains 3 HumidX F20 capsules for use.ALWAYS READ THE LABEL AND FOLLOW THE INSTRUCTIONS FOR USE. IF SYMPTOMS PERSIST, TALK TO YOUR HEALTHCARE PROFESSIONAL.",35,Home > Sleep Apnea > CPAP Accessories > Humidifiers > HumidX™ F20 (3 Pack),https://shop.resmed.com.au/humidx-f20-3-pack/,False,3.5,4
Sleep Apnea,SKU:38013,HumidX™ F20 (6 Pack),"6 pack of HumidX capsules for AirFit™ F20 or AirTouch™ F20 full face masks. Each one provides waterless humidification when used with a ResMed AirMini™ CPAP machine.
Description:HumidX heat moisture exchangers (HME) are designed to provide you with waterless humidification when you're using therapy.They work by capturing heat and moisture within tiny paper ridges when you exhale. They then release this heat and moisture to humidify the air when you inhale.Each pack contains 6 HumidX F20 capsules for use.ALWAYS READ THE LABEL AND FOLLOW THE INSTRUCTIONS FOR USE. IF SYMPTOMS PERSIST, TALK TO YOUR HEALTHCARE PROFESSIONAL.",59,Home > Sleep Apnea > CPAP Accessories > Humidifiers > HumidX™ F20 (6 Pack),https://shop.resmed.com.au/humidx-f20-6-pack/,False,4.4,12
Sleep Apnea,SKU:38878,AirFit™ N30 for AirMini™ Mask Pack,"This ResMed AirFit N30 mask is compatible with your ResMed AirMini CPAP machine. This pack includes HumidX heat and moisture exchangers for waterless humidification, AirMini flexible tubing and an AirFit N30 for AirMini mask.
Description:AirFit N30 is a CPAP mask that is designed to fit your lifestyle. It's ResMed's lightest mask ever* and features a soft, curved nasal cradle cushion and adjustable QuickFit™ elastic slip-on headgear. It includes three cushion sizes, SW, S and M, for your convenience.Key features:AirFit N30 for AirMini guides:",310,Home > Sleep Apnea > CPAP Masks > Nasal Cradle Masks > AirFit™ N30 for AirMini™ Mask Pack,https://shop.resmed.com.au/airfit-n30-for-airmini-mask-pack/,True,3.7,3
Sleep Apnea,SKU:38880,ResMed N30 Connector for AirMini™,"The N30 connector enables you to connect your ResMed AirFit™ N30 nasal cradle mask to the ResMed AirMini CPAP machine. It includes the AirMini compatible AirFit N30 frame and vent only. AirMini tubing is not included.
",80,Home > Sleep Apnea > CPAP Accessories > CPAP Mask Parts > ResMed N30 Connector for AirMini™,https://shop.resmed.com.au/resmed-n30-connector-for-airmini/,False,3,3
Sleep Apnea,SKU:33963,ResMed Tubing Wrap,"A smooth, heat-retaining cover for your standard tube. Reduces rainout and minimises drag on your bedclothes and your mask to provide a more stable seal and a more comfortable experience.
ResMed's Tube Wrap is made from microfibre, has a soft, fleecy feel, and keeps the warmth in the tube from machine to mask, minimising """"rain out"""" on those cold nights.Why would I buy one?Tube Wrap maintains hose temperature above room temperature by insulating the hose, which reduces the amount of condensation within the tube.Tube Wrap cloth cover softens the contact between the skin and the tubingTube Wrap hides the """"medical"""" appearance of the CPAP tubing.Zipper and Velcro end seal keeps Tube Wrap in place and effective.ALWAYS READ THE LABEL AND FOLLOW THE INSTRUCTIONS FOR USE. IF SYMPTOMS PERSIST, TALK TO YOUR HEALTHCARE PROFESSIONAL.",49.95,Home > Sleep Apnea > CPAP Accessories > Tubing > ResMed Tubing Wrap,https://shop.resmed.com.au/resmed-tubing-wrap/,False,4.6,8
Sleep Apnea,,BongoRx Replenishment Kit,"These are replacement nasal seals and are suitable if you have already used the Bongo Rx Starter Kit and are looking to replace your current nasal seals. Available in small, medium, large or extra large. Comes with 4 replacement cushions, case, head strap and drying standFor best results, it is recommended to replace these seals every 90 days to continue receiving the full benefits of the Bongo Rx.
",429,Home > Sleep Apnea > CPAP Alternatives > BongoRx Replenishment Kit,https://shop.resmed.com.au/bongorx-replenishment-kit/,False,3,3
Sleep Apnea,SKU:36810,ResMed SlimLine™ Tubing fits S9™ CPAP Machines,"Replacement slimline tube for the Resmed S9 series CPAP Machines
The SlimLine Tubing is one of our slimmest and most flexible tubes.It is designed to provide you with a seamless therapy experience by allowing you to move comfortably in your sleep.ALWAYS READ THE LABEL AND FOLLOW THE INSTRUCTIONS FOR USE. IF SYMPTOMS PERSIST, TALK TO YOUR HEALTHCARE PROFESSIONAL. FAQ'sQ: Does this tubing also fit ResMed Elite S8 cpap machine? A: Yes it will.  Q: Can this Slimline Tube be connected to a F&P Eson Nasal Mask? A: Yes Q: Will this tube be suitable for the ResMed AirSense 10 elite? A: Yes, without a humidifier in use.",21,Home > Sleep Apnea > CPAP Accessories > Tubing > ResMed SlimLine™ Tubing fits S9™ CPAP Machines,https://shop.resmed.com.au/resmed-slimline-tubing-fits-s9-cpap-machines/,False,4.8,4
Sleep Apnea,SKU:36811,ResMed SlimLine™ Tubing Wrap,"This smooth, heat-retaining cover for your standard tube reduces rainout and minimises drag on your bedclothes and your mask.
The SlimLine Tubing Wrap is a smooth, heat-retaining cover for the air tube that helps to make your therapy more comfortable.The sleek cover reduces drag on your clothes and on your mask for a peaceful and relaxing night's sleep.ALWAYS READ THE LABEL AND FOLLOWS THE INSTRUCTIONS FOR USE. IF SYMPTOMS PERSIST, TALK TO YOUR HEALTHCARE PROFESSIONAL.",49.95,Home > Sleep Apnea > CPAP Accessories > Tubing > ResMed SlimLine™ Tubing Wrap,https://shop.resmed.com.au/resmed-slimline-tubing-wrap/,False,0,0
Sleep Apnea,SKU:14994,ResMed Standard Tubing,"Standard, universal tubing with an inner diameter of 19 mm. Suitable for all ResMed CPAP therapy machines (except AirMini). Can also be used with machines from other manufacturers.
Our Standard Tubing is a non heated tube which can be used with all devices (except ResMed AirMini).ALWAYS READ THE LABEL AND FOLLOW THE INSTRUCTIONS FOR USE. IF SYMPTOMS PERSIST, TALK TO YOUR HEALTHCARE PROFESSIONAL.",18,Home > Sleep Apnea > CPAP Accessories > Tubing > ResMed Standard Tubing,https://shop.resmed.com.au/resmed-standard-tubing/,False,4,5
Sleep Apnea,SKU:61528,ResMed Swift™ FX Mask Short Tubing Assembly,"Used to attach the tubing from your CPAP machine to your Swift FX mask. (Pack of one)
The short tube assembly is part of the Swift FX nasal mask.It is used to attach the tubing from your device to your mask.You can remove and replace the tube assembly from your mask by removing the ring from the cushion.Single pack.",69,Home > Sleep Apnea > CPAP Accessories > Tubing > ResMed Swift™ FX Mask Short Tubing Assembly,https://shop.resmed.com.au/resmed-swift-fx-short-tubing-assembly/,False,4,1
Sleep Apnea,SKU:36920,ResMed S9™ Power Supply Unit 30W,"A lightweight, convenient 30W power solution for your ResMed S9 machine when you're travelling.
The S9 30W power supply is a great choice if you want a lightweight, convenient power solution for your device when you're travelling.It's a small power supply suitable for any ResMed S9 series device that you are using, if you don't need to use an H5i Heated Humidifier.",29.95,Home > Sleep Apnea > CPAP Accessories > Batteries and Power > ResMed S9™ Power Supply Unit 30W,https://shop.resmed.com.au/resmed-s9-power-supply-unit-30w/,False,0,0
Sleep Apnea,SKU:24946,ResMed RPSII Power Supply Unit Adapter,"Connect your ResMed S9 CPAP machine to the Power Station II battery with this adapter.
",35,Home > Sleep Apnea > CPAP Accessories > Batteries and Power > ResMed RPSII Power Supply Unit Adapter,https://shop.resmed.com.au/resmed-rpsii-power-supply-unit-adapter/,False,0,0
Sleep Apnea,SKU:24952,ResMed RPSII Carry Bag,"An ideal carry bag for your Power Station II (external battery). It's perfect for travel!
An ideal carry bag for your Power Station II (external battery). It's perfect for travel!ALWAYS READ THE LABEL AND FOLLOW THE INSTRUCTIONS FOR USE. IF SYMPTOMS PERSIST, TALK TO YOUR HEALTHCARE PROFESSIONAL.",60,Home > Sleep Apnea > CPAP Accessories > CPAP Bags > ResMed RPSII Carry Bag,https://shop.resmed.com.au/resmed-rpsii-carry-bag/,False,0,0
Sleep Apnea,SKU:36824,ResMed S9™ Power Supply Unit 90W,"The S9 90W power supply is an ideal for people using ResMed S9 machines with a Humidifier.
The S9 90W power supply is an ideal for people using ResMed S9 machines with a Humidifier.Q: Is this S9 Power Supply unit simply an uninterruptible power supply only to be used in conjunction with a regular AC (50 Hz 240 V) power supply? A: No, it is the basic power pack (mains to machine) required to run an S9 with a humidifier attached. An S9 not using a humidifier can use the 30w Power Supply unitQ: Is this part a 240 volt to 24 volt genuine ResMed power supply? A: Yes this is the genuine 90w ResMed power supply required to power both the machine and humidifierQ: Will this S9 Power Supply unit work in India? A: This is a power supply unit with an Australian plug configuration. In another country you would need to convert the plug configuration, however, this change would not affect the operation of the unit as it automatically works between 110v and 240v.",59.95,Home > Sleep Apnea > CPAP Accessories > Batteries and Power > ResMed S9™ Power Supply Unit 90W,https://shop.resmed.com.au/resmed-s9-power-supply-unit-90w/,False,4.7,3
Sleep Apnea,SKU:37342,ResMed PSU Adapter for AirSense™ 10,"Connect your ResMed AirSense device with the Power Station II for recharging.
",31,Home > Sleep Apnea > CPAP Accessories > Batteries and Power > ResMed PSU Adapter for AirSense™ 10,https://shop.resmed.com.au/resmed-psu-adapter-for-airsense-10/,False,0,0
Sleep Apnea,SKU:31336,ResScan™ Version 6.1 Software,"ResScan is a computer-based data management software (CD). It is intended to be used by Clinicians in conjunction with ResMed compatible therapy devices, using ResMed's proprietary communications protocol.
ResScan is a computer-based (CD) data management software. It takes a deeper look into your therapy performance using statistics and graphs allowing you to review your therapy breath-by-breath in order to better understand your progress.ResScan 6.1 is compatible with most devices and the data can be collected via the Data Card or USB, depending on the device you are using.Note: Only one can be purchased.ResMed ResScan Version 6.1 Software (sku: 31336) is the latest and followup version to ResMed ResScan Version 6.0.2 Software (sku: 31335)ALWAYS READ THE LABEL AND FOLLOW THE INSTRUCTIONS FOR USE. IF SYMPTOMS PERSIST, TALK TO YOUR HEALTHCARE PROFESSIONAL. ",29.99,Home > Sleep Apnea > CPAP Accessories > Data Management > ResScan™ Version 6.1 Software,https://shop.resmed.com.au/resscan-version-6-0-software/,False,3.2,20
Sleep Apnea,SKU:33976,ResMed S8 Hypoallergenic Filters (12 Pack),"Filters are a must-have for your ResMed S8 CPAP device if you suffer from allergies. These filters block particles such as dust, pollen and hair.
The disposable Hypoallergenic Filters are a must-have for your devices if you suffer from any allergies.This filter cleans the air as it enters your device.It consists of a combination of materials, with one side to block fine particles and the other to ward off large particles such as hair.",34.9,Home > Sleep Apnea > CPAP Accessories > CPAP Filters > ResMed S8 Hypoallergenic Filters (12 Pack),https://shop.resmed.com.au/resmed-s8-hypoallergenic-filters-12-pack/,False,4,1
Sleep Apnea,SKU:24926,ResMed Power Station II Battery,"Have power will travel! This external battery enables your device to function where power mains aren't available.
",469,Home > Sleep Apnea > CPAP Accessories > Batteries and Power > ResMed Power Station II Battery,https://shop.resmed.com.au/resmed-remote-power-station-ii-battery/,False,0,0
Sleep Apnea,SKU:36856,ResMed S9™ and AirSense™ 10 Hypoallergenic Filters (2 Pack),"Hypoallergenic Filters for use with any ResMed S9 or AirSense 10 devices.
The disposable Hypoallergenic Filters are designed to prevent debris and other particles from entering your device.These are available in a 2 pack. They are compatible with any S9 device and AirSense 10 devices.They should be changed regularly, around every 1-2 months.ALWAYS READ THE LABEL AND FOLLOW THE INSTRUCTIONS FOR USE. IF SYMPTOMS PERSIST, TALK TO YOUR HEALTHCARE PROFESSIONAL.",7.49,Home > Sleep Apnea > CPAP Accessories > CPAP Filters > ResMed S9™ and AirSense™ 10 Hypoallergenic Filters (2 Pack),https://shop.resmed.com.au/resmed-s9-and-airsense-10-hypoallergenic-filters-2-pack/,False,4.3,22
Sleep Apnea,SKU:36860,ResMed S9™ Travel Bag,"Your go to bag when travelling with your ResMed S9 CPAP machine.
The S9 Travel Bag is compact and convenient to hold your S9 device and humidifier while you're travelling.The bag has an additional storage compartment for extras, such as cleansing wipes or spare filters.",39.95,Home > Sleep Apnea > CPAP Accessories > CPAP Bags > ResMed S9™ Travel Bag,https://shop.resmed.com.au/resmed-s9-travel-bag/,False,5,1
Sleep Apnea,SKU:36996,ResMed ClimateLine™ Max Oxy Heated Tubing,"Ideal tubing for people who need supplemental oxygen.
If you require additional oxygen, this tubing is perfect for you! It easily connects at the back of your device, removing the hassle of another tube getting in the way. Supplemental oxygen is mixed with warmed, humidified air for your comfort.ALWAYS READ THE LABEL AND FOLLOW THE INSTRUCTIONS FOR USE. IF SYMPTOMS PERSIST, TALK TO YOUR HEALTHCARE PROFESSIONAL.",99,Home > Sleep Apnea > CPAP Accessories > Tubing > ResMed ClimateLine™ Max Oxy Heated Tubing,https://shop.resmed.com.au/resmed-climateline-max-oxy-tubing/,False,5,1
Sleep Apnea,SKU:37296,ResMed ClimateLineAir™ Heated Tubing for AirSense™ 10,"For AirSense 10 CPAP machines. This heated tubing provides the optimal temperature and humidity for your comfort and virtually eliminates rainout.
The ClimateLineAir is a heated tube that is purpose-built for ResMed AirSense 10 devices.This heated tube is specially designed to provide you with the optimal temperature and humidity for your comfort and virtually eliminates rainout.ALWAYS READ THE LABEL AND FOLLOW THE INSTRUCTIONS FOR USE. IF SYMPTOMS PERSIST, TALK TO YOUR HEALTHCARE PROFESSIONAL.",69,Home > Sleep Apnea > CPAP Accessories > Tubing > ResMed ClimateLineAir™ Heated Tubing for AirSense™ 10,https://shop.resmed.com.au/resmed-climateline-tubing-for-airsense-10/,False,4.6,56
Sleep Apnea,SKU:36995,ResMed ClimateLine™ Heated Tubing for S9™ CPAP Machines,"This tubing delivers warmed air at a consistent humidity level and is a key component of the Climate Control humidification system.
The ClimateLineAir tubing is designed for your comfort.For use with ResMed S9 CPAP machines.The tubing delivers warmed air at consistent humidity level and is a key component of the Climate Control humidification system.ALWAYS READ THE LABEL AND FOLLOW THE INSTRUCTIONS FOR USE. IF SYMPTOMS PERSIST, TALK TO YOUR HEALTHCARE PROFESSIONAL.",69,Home > Sleep Apnea > CPAP Accessories > Tubing > ResMed ClimateLine™ Heated Tubing for S9™ CPAP Machines,https://shop.resmed.com.au/resmed-climateline-tubing-for-s9-cpap-machines/,False,4.4,14
Sleep Apnea,SKU:37343,ResMed Connector Cable for AirSense™ 10 to ResMed Power Station II,"Connect your ResMed AirSense 10 CPAP machine to the external Power Station II battery with this DC cable.
",35,Home > Sleep Apnea > CPAP Accessories > Batteries and Power > ResMed Connector Cable for AirSense™ 10 to ResMed Power Station II,https://shop.resmed.com.au/resmed-connector-cable-for-airsense-10-to-powerstation-ii/,False,5,1
Sleep Apnea,SKU:24961,ResMed Connector Cable for S9™ to ResMed Power Station II,"Connect your ResMed S9 CPAP machine to the external Power Station II battery with this DC cable.
",29,Home > Sleep Apnea > CPAP Accessories > Batteries and Power > ResMed Connector Cable for S9™ to ResMed Power Station II,https://shop.resmed.com.au/resmed-connector-cable-from-s9-to-powerstation-ii/,False,5,1
Sleep Apnea,SKU:37297,"ResMed AirSense™ 10, AirCurve™ 10 and Lumis™ DC-DC Converter","Run your AirSense 10, AirCurve 10 or Lumis machine from a suitable DC power source like your car, boat or caravan.
Heading off on holidays and need to connect your AirSense 10, AirCurve 10 or Lumis machine?With this DC/DC converter, you can connect your machine to a car, truck, caravan, boat or any other vehicle with a suitable battery. This converter draws approximately 1 amp of power and uses the vehicle's cigarette lighter socket (12V or 24V DC power source).ALWAYS READ THE LABEL AND FOLLOW THE INSTRUCTIONS FOR USE. IF SYMPTOMS PERSIST, TALK TO YOUR HEALTHCARE PROFESSIONAL.",149,"Home > Sleep Apnea > CPAP Accessories > Batteries and Power > ResMed AirSense™ 10, AirCurve™ 10 and Lumis™ DC-DC Converter",https://shop.resmed.com.au/resmed-converter-for-airsense-10-dc-dc/,False,4.7,22
Sleep Apnea,SKU:36970,ResMed DC 12v and 24v S9 Model Converter,"Operate your ResMed S9 machine from a suitable 12v or 24v DC power source like a boat or campervan.
Wondering how to continue using your ResMed S9 CPAP machine on holiday?This converter will help solve your problem!It easily connects your device on a car, truck, caravan, boat or any suitable 12 V or 24V power source.",169,Home > Sleep Apnea > CPAP Accessories > Batteries and Power > ResMed DC 12v and 24v S9 Model Converter,https://shop.resmed.com.au/resmed-dc-12v-and-24v-s9-model-converter/,False,5,3
Sleep Apnea,SKU:36859,ResMed Filter Cover for S9™ Series Machines,"Need a new filter cover for your ResMed S9 CPAP machine? You found it!
This Filter Cover is used to cover the filter compartment of your ResMed S9 CPAP Machine.It's easy to take off and put on, making it quick and simply for you to change the filter to give you filtered air during your therapy.If you lose or break the filter cover on your device, this is the perfect replacement!",8.9,Home > Sleep Apnea > CPAP Accessories > CPAP Machine Parts > ResMed Filter Cover for S9™ Series Machines,https://shop.resmed.com.au/resmed-filter-cover-for-s9-series-machines/,False,0,0
Sleep Apnea,,ResMed AirFit™ P30i Pillows Mask,"The Airfit P30i CPAP mask is a nasal cradle mask designed to keep tubing out of the way and give back the freedom to sleep any way you want. With a soft-fitting frame that is designed to keep you supported all night,  and our QuietAir™ vent designed to minimise noise this mask is an ideal fit for quiet nights with our partners.
Key FeaturesSize OptionsAirFit P30i GuidesAirFit P30i masks can easily be used with most CPAP devices (except the ResMed AirMini due to its specialised ventilation system).ALWAYS READ THE LABEL AND FOLLOW THE INSTRUCTIONS FOR USE. IF SYMPTOMS PERSIST, TALK TO YOUR HEALTHCARE PROFESSIONAL. ",229,Home > Sleep Apnea > CPAP Masks > Nasal Pillow Masks > ResMed AirFit™ P30i Pillows Mask,https://shop.resmed.com.au/resmed-airfit-p30i-pillows-mask/,True,3.7,23
